Okay, so just spoke to the nurse and the reason that your doctor is late is because uh, she's not coming.	0
Which	0
How would you characterize the theme of this book, uh let's see here , Rachel Green?	0
Umm, well I would have to say that it's a, it's tragic love story.	0
Well, that's sort of a given, but yes. Anyone else?	0
Oh-oh-oh, symbolism! And uh, the-the uh, wildness of the mores, which	1
Excellent! What Rachel has shrewdly observed here	1
You completely stole my answer!	4
Well how would you know?! You didn't even read it!	4
What do you think? You in the blue shirt.	0
I think that uh, yours is a question with many answers.	0
Would ya care to venture one?	0
Would	0
Are you just repeating what I'm saying?	4
Are you just repeating what	0
All right, let's move on.	0
Okay then.	0
All right, okay, this is great, uh, Chandler, you get behind the desk.	0
And-and when she comes in hopefully, she won't recognise you because, well, why would she?	0
Uh, okay, and then you buzz Ross and I.	0
You be Mr. Gonzalez, and I'll be uh, Mr. Wong.	0
Diverse.	0
Did anybody call for security?	0
You be cool.	0
Okay, which one of you guys is Gunther Central-Perk?  Hey, Joey?	0
Where's my ring? My dead grandmother's wedding ring? Where is it? Where is it?	5
Way to be cool, man.	0
What's he talking about?	0
Wait, you guys think I stole some ring?	2
We know you took so just-just save yourself the time and confess!	4
Okay, who are you?	2
Look, I don't need to steal some stupid ring, all right?	4
I make $1,600 a week doing what I do; any of you guys make that?	4
Marry me.	0
Oh my God! Joey!	2
Hell yeah! I'll marry you!	1
You can't marry him!	4
Phoebe!	2
Why?! Why can't she marry me?!	2
She's not pregnant. It's Rachel. Rachel's the one who's pregnant.	0
Oh my God.	2
It's Joey!	2
Now I can't believe it! What? Rachel's pregnant?  Who's the father?	2
We don't know.	0
Ohh  I wonder if that dude.	0
There's a dude?	2
Yeah.	0
Who? Who is it?	2
Was that story over?	0
The guy left this.	0
Oh my God! I know who the father is	2
Oh my God, you're back!	2
Ohh, let me see it! Let me see your hand!	2
Why do you want to see my hand?	0
Yeah.	0
No!	4
Hey, when the music starts up again, I was thinking of maybe goind into the robot, y'know?	0
Alright we're back! Ten seconds left here we go! Ten! Nine! Eight! Seven!	1
Three, Two, One!	0
Cut!	0
No! Year! Happy No Year!	1
Okay, here's where we go to the live shot of Times Square, nice work everyone that's a wrap!	1
So Lizzie, are-are-are you planning on staying the night?	0
Oh no-no believe me, I'm leaving as soon as possible!	0
Good. Good. Not that we don't want you to stay, obviously you're welcome-How much more homework do you have?	0
I see. Y'know umm, Phoebe makes sock bunnies.	0
No!	2
No, she doesn't.	0
Uh Phoebe, what she makes-that's uh-they're sock rabbits.	0
They are completely different-Okay!	4
Okay!	2
Okay!	2
I'm sorry!	3
I totally forgot about tonight and the fact that we're supposed to	0
Oh, it's okay. I don't	0
Y'know I'm just gonna-I, I am gonna make this up to you!	1
I-I am going to	0
Well, I did put a lot of thought in the tape.	0
No.  And then I called him, and he wasn't there.	0
Well, then he's, he's probably just, out.	0
Hello.	0
Hi! Oh, I'm so glad you called.	1
Hey, what do you want to drink?	0
Who's that?	2
Nobody.	0
Is it okay if I finish the apple juice?	0
Is that Mark?	0
Umm, honey, look he just came over to....	0
Hey, you don't have to smile. You just have to dance.	0
Oh, okay.  Hey, two beers.	0
You wanna go in the bedroom? It's a little more comfortable.	0
Sure.	0
Okay.  Oh wait! Umm, did you send those contracts to Milan?	2
If this is your idea of sexy talk?	2
What contracts?	0
Like what?	0
Tag!	4
I'm serious!	4
This isn't funny!	4
Those contracts absolutely had to go out today!	4
Rach, I'm sorry, but you didn't give me any contracts!	2
Yes I did! And I put a little	4
I'm telling you, you never gave them to me.	0
Y'know what Tag, if we went down to the office you would see those contracts sitting on your desk.	4
You wanna go down to the office right now?	0
No! Come on its late, we're not gonna go down to the office.	4
Okay I understand.  I wouldn't want to be proved wrong either.	0
Okay get your coat!  Oh! When did you unhook this?  Nice work!	1
Hey Ross, this is one of my co-stars, Dirk.  Dirk, this    is my good friend Ross.	0
Nice to meet you.	0
Oh and I need to talk to you.	0
About what?	0
To see if know what these guys are talking about.	0
Pheebs, how's it going?	0
I'm doing okay. I think it's going well. Do you think they're having fun? Am I talking to fast?	0
Nope, sound like me. Pheebs, it's going great. Look at Chandler with little baby girl Chandler.	1
Little baby girl Chandler, where I have heard that before?	0
Oh right, Coach Ruben.	0
Do you know what Pheebs?	0
When you're done over there, we kinda have a situation over here too.	5
Na-uh, no, we are all responsible for our own babies.	0
See that's where I think that you're wrong. We've been playing these babies man for man; we should really be playing a zone defense.	0
What do you mean?	2
Forgive me? You haven't been taking my calls in a week!	4
Well, I'm totally over it Chandler. Friends forever! Don't come out here!	4
Uh, what was that?	2
Uh,	0
...I'm, I'm okay.	0
That sounds good. I'll call you- or you call me, whatever...	0
Okay.	0
Bye.	0
Whoo-hoo!	1
Yeah, there you go!	1
Second date!	1
...I dunno.	0
You	0
Remember when you where a kid and your Mom would drop you off at the movies with a jar of jam and a little spoon?	0
You're so pretty.	1
Hi!	1
Hey, Phoebe.	0
Hey, oh, you know that guy who's been following me? I talked to him today.	0
You talked to him. Are you crazy?	2
Thank you, Happy Holidays.	1
Now, that's trash. Young lady, you can't   Hey! Stop that young lady, she donated trash!	4
The charity's on fire!	5
Help!	5
Oh good!	1
Thank you, I need that.	1
Whoa!	2
What is that?!	2
It's nine o'clock in the morning!	2
Can I help you?	0
Uh yeah, where-where's the guy who decides who's pictures go up on the wall?	0
He's not here right now.	0
Oh, you're kidding me!	4
All-all right, well make sure you tell him that Joey Tribbiani stopped by to drop off all of these clothes.	0
Okay?	0
I'm an actor; I'm kinda getting my picture up there on the wall.	0
Y'know, there are two people who could put your picture up there.	0
Oh really? Well, maybe you and I go out for drinks?  You're the other one right?	0
What?! You're crazy! There's nothing sexual about the noises I make!	2
Really?	2
I mean hi.	0
No look, I have, I have lots of clients that make the same noises you do!	0
Really?!	2
Well not clients, lovers. But let's just y'know, try it again. Come back and-and we'll work through it.	0
Are you sure?	2
Yes.	0
I guess.	0
Great! Okay, if you'll just excuse me.  So, did you hear something you liked?	1
Oh no! My parents have never seen me drunk!  That they know of.	5
Okay, here's the thing. We're gonna get you some coffee and they will never know that you're drunk.	0
Yeah, I'll take care of it.	0
Okay. I love you so much.	1
Okay we have to do something about your breath.	0
What about	2
That's still yours. Okay, now remember it's a surprise party. So, when you go in, act surprised.	0
Okay. I can do that.	0
Okay.	0
Surprise!!!	2
Thanks for the coffee, or bedankt voor de koffie, Gunter.	0
Yeah, we're done.	0
Ezel? Ezel? Ezel?	2
Hey Ross! Listen, do you want to go see that new Imax movie on tide pools?	1
Really?!	2
No. But I got Knicks tickets for you, me, and Chandler.	0
Sweet!	1
All right, well finish your coffee; let's go.	0
Uh actually, sorry I can't even make it. I'm seeing Mona again tonight.	0
I'm sorry I gotta cancel tonight baby	3
So it's down to these two, Nancy I know you like this one and I think I agree. Rachel, what do you think?	0
Oh don't be sorry, that's part of your job here to give your opinions and then I take credit for them--I'm kidding.	0
She is kidding, but don't ever disagree with her again. Okay, now I'm kidding!	1
Oh, what a fun office.	1
I don't know which one, but I do know I need a cigarette.	0
So what do you say we take a break, we go outside, and we'll figure this out when we come back?	0
Rachel? Do you smoke?	0
Oh no, my dad's a doctor and he would always tell me just horror stories  about ghosts and goblins who totally supported the princess's right to smoke.	0
What?	0
Peach pit.	0
Yes, Bunny?	0
Peach pit. That night we, uh- we had-	0
-Peaches?	0
Actually, nectarines, but basically...	0
Could've been a peach.	0
Then, uh, then we got dressed, and I-I... I walked her to the-  -the bus stop... I'm fine.	0
All right!	1
Westminster Abbey!	1
Hands down, best Abbey I've ever seen.	1
Hey!	1
Okay.	0
What do you think of the Abbey, Chandler?	0
I think it's great. It's great. Y'know, they're thinking of changing the name of this place.	0
Really? To what?	2
Man,	0
Y'know, I can't believe I'm getting my nails done!  And	2
Chandler, there's a guy right over there.	0
That's a mailman! That's	2
Chandler, don't worry! This doesn't make you any less of a guy!	0
Hey, you know who used to have nails like that?	0
Hmm.	0
What?	0
Rachel?	0
Yeah.	0
Do you remember when you first came here, how you spent two weeks getting trained by another waitress?	0
Good one. Actually, ah, Terry wants you to take the training again, whenever.	0
Yeah?	0
No, you said the baby creeps you out.	0
You said the baby.	0
You guys, I'm sorry, could you please talk a little slower?	0
This is going in your book?	2
Yeah, it's about relationships. Y'know? The traps, the pitfalls, what not to do, keep going. This stuff is great!	1
What?! Excuse me!	2
And how none of it matters when the people really love each other.	0
And how people will believe anything you tell them as long as it's a compliment.	0
Yeah!!!!	1
Yes, I made it!	1
I'm on time!	1
Okay, why don't we all uh,  open our books to page 23.	0
Where   Where you will see a uh a bunch of uh red spots.	0
Okay,  umm, why don't, why don't you all start to read, while I-	0
Hey! Y'know that teacher who had a baby with her student?	0
What the? What	2
Miss? May I help you?	0
But after I unpacked the boxes I wanted to do something nice for you, so, I-I-I cleaned the apartment.	0
So I moved everything around and then I forgot where it, where it went back and I'm sorry, I'm very sorry, I'm sorry, I'm sorry.	3
It's okay. Chandler, are you afraid of me or something?	0
Do you want me to be afraid of you?	0
Of course not.	0
I mean gosh, Chandler what you did, it's, it's a wonderful thing and I really appreciate it.	1
Really?	2
Of course!	0
All right, hold on okay? First thing's first.  Okay, now did Ross sit	0
Okay, that's it. I cannot make this decision! It is	4
Well, I don't know what else to do.	3
Okay then.	0
Here we go.	0
Ask again later.	0
Later is not good enough.	4
Ask again later.	0
What the hell!	4
This is broken!	4
It-it is broken!	4
All right, let me see.  Will Chandler have sex tonight?  Don't count on it. Seems like it works to me.	0
Excuse me.	0
Yeah?	0
Are you Phoebe Buffay?	0
Yeah.	0
Can-can I get your autograph, I'm your biggest fan.	1
I think she took it pretty well. You know Paolo's over there right now, so...	0
Ah...ooh! Well, looks like, uh, we kicked your butts.	1
Come on, two on one.	0
What are you still doing here? She just broke up with the guy, it's time for you to swoop in!	2
What, now?	2
Yes, now is when you swoop!	1
You gotta make sure that when Paolo walks out of there, the first guy Rachel sees is you, She's gotta know that you're everything he's not!	1
My Catholic friend is right.	0
She's distraught.	0
You're there for her.	0
You pick up the pieces, and then you usher in the age of Ross!	1
Well, I just called Joshua	0
Well, I did my best to convince him that I'm not some crazy girl who is dying to get married-I'm just going through a hard time.	0
What did he say?	0
Yeah, maybe, but I don't think I even care.	3
I don't think he's the one I'm sad about.	3
Y'know, I know that I said that I am totally okay with Ross getting married, but as it turns out, I don't think I'm handling it all that well.	3
Yeah, maybe.	3
And I-I am just trying to figure out why.	3
Well, yeah, y'know how Ross and I were on again, off again, on again, off again?	3
I guess I just figured that somewhere down the road, we would be on again.	3
I don't get it!	2
Shh!	4
We're trying to think!	4
This is the unit for you my friend. Sturdy construction, tons of storage compartments, some big enough to fit a grown man.	0
What?!	2
Oh yeah!	1
I got in there myself once.	0
My roommate bet me five bucks that I couldn't, and then he stuck a board through the handles that locked me in.	0
Yeah.	0
No, you, you can't fit in that thing. That's not deep enough.	0
All right, you have yourself a deal.	0
Okay.  See?! I told ya!	2
Hey! What's up?	0
Hey-hey, who's your friend?  Hey!!	1
Hey Joey!	1
Erin! Still here!	1
Yeah, we ended up spending the day together and had such a great time!	1
Why wouldn't ya? Erin is great! Then-then there's you guys.	1
Ohh, listen. I've got to get going. Today was great, thanks!	1
Y'know, I gotta tell ya, I just	0
Really?!	2
Ohh!	2
Because I think about shaving it all off again sometime.	0
Really?!	2
Yeah!	1
I mean you definitely should do that.	0
Y'know what, I should do it.	1
Yeah!	1
Yeah, thank you Rachel, you are soo cool.	1
Awww, stop. Come on. Now go shave that head!	0
All right.	0
This woman's living my life.	4
What?	2
She's living my life, and she's doing it better than me!	4
You're not an artist.	0
I can't believe you would actually say that. I would much rather be Mr.Peanut than Mr.Salty.	2
I don't know, you don't wanna mess with corn nuts. They're craaazy.	0
I can't believe it! He's looking right at us!	2
How can people do that?...  Oh, you guys, look! Ugly Naked Guy got gravity boots!	2
Man that was great! Huh? Can you believe how long we threw that ball around?	1
No, I meant with the dropper over here.	0
Y'know, how did I get this reputation as a dropper? Okay? I'm	4
Hey Rach, can you pass me the	0
Yep!	0
Go!!	1
What?!! Stop it! Stop it! Oh my God!	2
Oh!	2
Hey!	1
Hey! You were really great! You were really, really great!	1
Oh, thanks, thanks.	1
So Monica tells me that uh, you don't want to play anymore because me and y'know my talent.	0
Is that true?	0
Well, kinda. Yeah. Yeah.	0
Pheebs	0
Hey.	0
I just saw a woman breast feeding both of her twins at the same time; it is like a freak show up here.	0
What's the matter?	0
Nothing.	0
Really it's nothing. I'm just	3
Rach come on, what?	0
I've just been thinking about how my baby and I are gonna be all alone.	3
What are you talking about alone? What about Ross?	2
Oh please, he'll be with his real family, the twins and little miss new boobs.	3
Okay, how long was I watching that woman?	0
I'm just saying that y'know, someday Ross is gonna meet somebody and he's gonna have his own life. Right?	3
Yeah, I guess so.	0
I just never thought I would raise this baby all by myself. Pretty dumb huh?	3
Bob. Bob! Bob!!!  What the hell are you doing?!	2
I just found out this is Chandler's office! Come on Toby, give me a hand!	1
We said seven!	4
We said six!	4
The only way that I said six would be if the seven's, let meet at seven, not at six.	0
Yeah and if I had seven, maybe I would've said something like this, "Wow! My boyfriend's such a wise ass-seven!"	4
Hi!	1
What?!	2
Well actually, I know what time Chester and Marcia said.	0
You, get out of my shop!	4
Well, what did he do?	2
He went out with my wife!	4
Joey!	2
That's my wife!!! Get out!	4
Well, we should go.	0
Yeah.	0
Y'know you, really didn't have to take me to the airport.	0
Oh please.	0
Y'know?	0
Well, we're really not that close.  Okay, so I guess this is uh, good-bye then.	0
Yeah, I was going for the metaphor.	0
Yes, and I was saying the actual words.	0
So big deal, so Joey's had a lot of girlfriends, it doesn't mean he's great in bed.	0
We share a wall! So either he's great in bed, or she just likes to agree with him a lot.	0
Sweetie, with you it's gonna be different. The sex is gonna be great, 'cause you-you guys are in love.	1
Yeah?	2
Yeah!	1
Just go for it Chandler.	0
Yeah, you should.	0
Yeah, you should, really.	0
Go on.	0
All right, all right, I'll go sleep with my girlfriend. But I'm just doing it for you guys.	0
You just ahh, you just need more practice.	0
Here, come on, let's ahh, let's try it again.	0
Come on.	0
Oh, I	0
Are you sure? I'll bet there's another flight to Minsk in like	0
July. Umm,	0
Please, clean my beakers. I don't get out of the lab much.	0
Yeah, I  Well I really actually wanted to say umm, that, but um, I figured I probably shouldn't because y'know, I have to leave.	0
Bye Phoebe.	0
I know.	0
Oh-oh, wait did you hear that-hear that?	2
No, I do not hear that.	0
Yeah, I-I heard.  I think it's great!  Ohh, I'm so happy for you!	1
Oh, well, that's great!	1
Yeah! Yeah!	1
I can't believe you're getting married!	1
Yeah.	0
Monica and Rachel made out.	0
Ohhh!	2
Why are we in bed together?	2
I don't know. Do-do you have any clothes on?	0
Yeah.	0
Really?!	2
No!	0
But we-we didn't have sex-uh, did we?	5
I mean, I don't remember much about last night, it was such a blur.	0
Oh! I remember laughing! I laughed a lot.	1
And we didn't have sex.	0
Ohh, I mean, we were really drunk. I'm just glad we didn't do anything stupid.	0
Tell me about it.	0
What are we gonna do?	0
I say we go with	0
Chandler?	0
Did she see us yet? Did she see us?	0
Hi, remember us?	0
Um, okay. You just called a little while ago about needing a signature on the admissions form. Well, it turns out we need a	0
I am. I'm	0
Yeah, and and, I'm just gonna pay for this with a check.	0
Yeah, I know...  ..I'm I'm just not that bright either.	3
Hey, Mon, if you were hoping to sleep with Joshua the first time tonight, which one of these would you want to be wearing.	0
Y'know what? It	0
Sorry.	0
I'm so exited!	1
I've been waiting for this for months!	1
I got my hair coloured!	1
I got new sheets!	1
I'm making him a	1
Um-hmm.	0
What am I making him by the way?	0
Well, you're making him a frieze salad with goat cheese and pine nuts, wild nuts, wild rice, roast asparagus, and salmon au croup.	0
I thought I was making him filet mignon?	2
Yeah, you were, but you decided to make salmon because you had some left over at the restaurant.	0
Wow, I really get crabby when I cook.	2
Y'know it's like uh, Biology!	0
Check it out. Okay, I can play this when the guests are coming in. Okay.	0
If you would've let me finish, it goes on to say that he's probably not gay.	0
You are falling fast asleep.	0
Deeper.	0
Deeper.	0
Deeper.	0
You are now completely asleep.	0
You don't need to smoke.	0
Cigarettes don't control you.	0
You are a strong, confident woman, who does not need to smoke.	0
A strong, confident woman.	0
Thank you for your patience, you're the next caller.	0
Yes!! Yes!! I'm the next caller! You were gonna have me hang up.	1
Hey! Can you take a duck and a chick to the theatre?	0
No.	0
Okay. I just wanted them to hear it from somebody else.	0
So how are things going with Paul?	0
Good.	1
Y'know, I wish I could get him to open up a little bit, share some feelings.	3
That's easy! You just have to think of him as a-as a jar of pickles that won't open.	0
So what are you saying; I should run him under hot water and bang his head against a table?	2
No that's what you do when you want to get the truth out of someone.	0
Hi honey.	0
Hi!	1
Okay, Ben, I won't tell your daddy that you had ice cream for dinner, if you don't tell about our little bonking incident.	5
Monica, number one, I don't think Ben understands the concept of bribery, and number two, I...   What?!	2
You said number two.	0
I also said number one.	0
Remind me to review with you which pot is decaf and which is regular.	0
Can't I just look at the handles on them?	0
You would think.	0
Okay, fine.	0
Because, I don't care.	0
I don't care.	0
What?!	2
Does this mean we're gonna have to start paying for coffee?	2
I know.  Yeah, his name is Pat.	0
Pat the dog. Oh! Oh! I get it!!	1
Do you uh, do you-ready for a refill?	0
Oh, I probably shouldn't-so I will!  Oh! Wow! It's like it's raining!	2
Pretty cool, huh?	1
But if you're thinking you can put a fish in there and it wouldn't get sucked up into the mechanism, well you'd be wrong.	0
Umm, can I use your bathroom?	0
It's uh, right through there.	0
Yeah, life's pretty great isn't it?	1
Yeah, it sure is!	1
You know, I think I was sixteen.	0
Please, just a little bit off the back.	0
I'm still on "no."	0
Uh, morning. Do you guys think you could close your eyes for just a sec?	0
No-no-no-no-no,  I'm not fallin' for that again.	4
What's goin' on?	0
Well, I sorta did a stupid thing last night.	0
I know.	0
See, yes.	0
That's Yasmine Bleeth, she's a completely different kind of chick.	0
I love you both.	0
But in very different ways.	0
Hey!	2
Hey!	2
(sees he's watching	0
Thanks, I'm glad you see it that way.	1
Ohhh-hoo, funny story!	1
So Chandler, have you heard about Monica's secret boyfriend?	0
So Mon, when are we gonna meet this new secret waiter man?	0
Ohh, he's really shy. I-I don't think he's up to meeting everyone yet.	0
Yeah, I don't think he's up to meeting everyone yet.	0
Really?! That's what you heard?  You said that?	2
I might've said that.  Why is that funny?	0
Because I'm very happy for him!  And	1
All right, well, I just can't think about that right now. I just wanna say good-bye to my Grandma.	0
Okay.	0
All right, let's go say good-bye.	0
Hey!	0
Did you get all this stuff for Joey to try and drive me out of the apartment?	4
Fish!	2
It wouldn't have mattered anyway, Phoebe, you and I are, are gonna live together, we're roommates; that's the deal.	0
Yes, but I wanted you to want to live with me, but okay, if you're having so much fun over here	3
Oh, it's so much more fun with you.	1
We did have fun, didn't we?	1
We did!	1
Oh, anyway, they say, if we want, we can see it tonight.	0
Oh, I would love to!	1
Yay, okay!	1
Good, good, good, good, good.	1
Great, all right, okay, and Monica ask me to make the drumming stop.	0
Um...  Done!	0
You're, hey, you're not paying for the pizza!	2
Oh come on, it's only fair, you paid for the flight. Now is, is that enough lire?	0
Ahh, I'd throw another thousand on that.	0
Why, how much is that?	0
That's about 60 cents.	0
Okay, it's coffee.	0
Ice coffee? Tell me it's ice coffee!	2
It's-it's hot	0
Hot coffee!!!	2
You idiot!!	4
You were gonna spill hot coffee all over me, huh?!!	4
What are you just some big, dumb, stupid, doofy idiot, with a doofy idiot hairdo, huh?!	4
!	4
What's your favourite thing about summertime?	0
Umm, going to the beach. When it stays light real late.	0
Yeah	0
Hey!	2
Tommyyyy! Say, what's your favourite thing about summer?	1
Ooh, I don't know. Probably the smell of freshly cut grass.	0
OK, try this salmon mousse.	0
Mmmm. Good.	1
Is it better than the other salmon mousse?	0
Yeah, well, is that	0
My God! What happened to you?	2
That's so great! 'Cause you already know how to do that!	1
Here you go, maybe this'll cheer you up.	1
Ooh, you know, I had a grape about five hours ago, so I'd better split this with you.	0
I thought it was gonna be a closed casket.	0
Sweetie, you think you can get in there?	0
I don't see why not.	0
Here's my retainer!	0
Someone in there?	0
Jeez, man did you fall.. Hi! So ah, did ya, did-did-did ya fall high?	2
Someone was in the lady's room, I couldn't wait. I left the lid up for ya though.	0
Y'know what Gunther, go ah, go ahead, I'm-I'm talking to ah, .  This is the part where you say your name.	0
Ginger.	0
Ginger. I'm talking to Ginger, so....	0
Don't you have to use the bathroom?	0
Nope, nope, I'd just ah, I'd rather talk to you.	0
Yes, I do.	0
Yes, I do have to go to the bathroom.	0
Someone in here.	0
I'm going to keep dating him Mother, and there's nothing you can do about it!	4
Oh yes there is!	4
What are you going to do? Kill him? Like you did with Charles?!	4
That was an accident! And so were you.	4
Well, at least I'm not a murderer!	4
That was a great scene! And-and-and that slap looks so real! How do you do that?	2
Oh, just years of experience.	0
Oh anyway, I just wanted to say how wonderful I think you are.	1
Say what?	2
I'm supposed to meet and hug a fan who's dying, but that's not supposed to be until  later!	0
Oh that was a real person?!	2
I-I-I'm leaving the show?	2
I don't know. Why? Did you hear something?	0
Who told you that?	2
Which one? Was it bald or was it tall?	2
Umm	0
Feel better?	0
Yeah!	1
Much!	1
Yeah, I understand.	0
Yeah! Okay!  Hey! Hi!	1
Hi!	1
Y'know, you look familiar. Do I know you from somewhere?	2
I don't think so.	0
Wow!	2
Yeah.	0
Really?!	2
Hm-mmm.	0
$4.50 please.	0
Oh, let me get this.    These are for you.	0
Alright, alright, alright.	0
There you go!	1
Would you like to call somebody?	0
Yeah, about 300 guys I went to high school with.	0
Okay! Feel free to look, but I'm telling you those contracts are not on this desk.	4
Oh	0
It's my sister.	0
Okay, very cute braces. Anyway y'know what, the	0
In the afternoon. Mr. Zelner came into my office after lunch. He put them on my desk, and then I put a	0
Phoebe, she doesn't know that you sneak out every night, she doesn't know that you sneak back every morning, and she doesn't know that you've been living with your Grandmother's for a week now.	0
Okay, well maybe not on those levels.	0
Hey.	0
Hey.	0
I'm never gonna find a roommate, ever.	3
Why, nobody good?	0
Nice to meet you, Chandler Bing	0
So how many more do you have tomorrow?	0
Two.	0
This photographer, who seemed really dull.	0
And this actor guy, who I'm not sure about, because when he called and I answered the phone 'Chandler Bing,' he said 'Whoa-whoa, short message.'	0
Ross , foot on the floor or come over no more!	0
What?	0
I have to go. Yeah, Carol should be home by now, soo...	0
Umm, how's it going with you guys?	0
Oh, better, actually. Y'know I-I-I think I finally figured out why we were having so much trouble lately.	0
Oh, really?	2
