Yeah, y'know how I have you guys, well she doesn't really have any close friends that are just hers, but last week she meet this woman at the gym, Susan something, and they really hit it off, and I-I-I think it's gonna make a difference	1
Hey!	0
Hi!	0
Oh, just some pictures I made and hung up. I thought they'd brighten up the place. They do don't you think?	1
Well, how-how come?	0
That's just the way it is.	0
That's crazy.	2
Maybe it's crazy in a perfect world, a world without lab coats and blazers, but you not in a perfect world, you in a museum now.	0
See that scientist in the classes, he and I used to play together all the time in grade school, but now  Peter!	0
Hey, Peter!	0
It's me Rhonda!	0
From PS-129!	0
I gave you my	0
I-I think everybody's pretending they don't hear you.	0
Anyway, look, I don't know about you and your jackets and your separate tables, but Ross is one of my best friends, and if I save him a seat, I'm telling you, he	0
That's okay, I'm cool over here. I'll catch up with you later, Joey.	0
Op, this is saved.  Gift shop.	0
How's that coffee comin,' dear?	0
Yeah, right away Mr. Kaplan.	0
I'm not supposed to drink coffee, it makes me gassy.	0
I'll bet your thinking, 'What's an intelligent girl who wants to be in fashion, doing making coffee?' Eh?	2
Op.	0
Oh, you got me.	0
Well, don't think I haven't noticed your potential.	0
Well, I've got a project for you that's a lot more related to fashion.	0
How does that sound?	0
Oh, that sounds great.	1
Come on over here, sweetheart.	0
Oh thank you so much Mr. Kaplan, thank you so much.	1
Well, I y'know, I was just, umm, I was just thinking and hoping, that umm, maybe you'd want to get back together?	5
No. But thanks.	0
Aw come on Phoebe would you just think about it?	3
Okay. No. But thanks.	0
Okay, ah, see ya Pheebs.	0
Wow, that was kinda brutal.	2
Well okay, let this be a lesson to all of you, all right.	0
Once you, once you betray me, I become like the ice woman, y'know.	0
Very cold, hard, unyielding, y'know nothing,	0
Yeah, sure.	0
Wow.	2
I'm, I'm really sorry.	0
Yeah, I'm sorry too. But, I gotta tell you, I am a little relieved.	0
Relieved?	2
Yeah, well, I had a great time with you.. I just can't stand your friends.	0
She wants	0
Oh my God! If you say that one more time,	4
Fine!	4
Fine!	4
But this break-up was not all my fault, and she, she says here,  'If you accept full responsibility...'  Full responsibility!	4
'...I can begin to trust you again.	4
Does that seem like something you can do.	4
Does it?!	4
!'	4
No?	2
Look, Ross, you have what you want, you're back with Rachel.	0
If you bring this up now you're gonna wreck the best thing that even happened to you.	0
Yeah, I know.	3
I mean, no, you're right.	3
Yeah I guess I'll let it go.	0
But you-you understand how-how hard it is to forget about this.	3
Sure, it's hard to forget!	0
But that doesn't mean you have to talk about it!	0
A lot of things happened on that trip that we should never,  ever talk about.	0
What the hell happened on that beach?!	2
It's between us and the sea, Ross!	0
See my friend-my friend, Rachel, she wants to be set up.	0
Ahh, I just got out of a big relationship, I'm not looking for any thing serious.	3
Oh, y'know what, that might be okay even if it was just kind of a fling, that might be all right with Rachel.	0
Whoa-whoa-whoa-whoa! Is this, hot Rachel, that you took to the Christmas party, Rachel?	2
Oh, by the way, that is her full name.	0
Oh wow! I'm free for her!	1
Oh, wait a second! I didn't say I wasn't free!	2
Hey, Chandler, why don't we talk this over at the Ranger game tomorrow?	0
Hold on, y'know I	0
Maybe, before the game we could enjoy some eight year old some small batch Basel Hadens.	0
Well, I don't really know what that is, but	0
Monica, let's go. Come on now people, woman in labor.	0
Hey Ross, look what I've got going here.	0
What are you doing? We're going to a hospital.	2
What, so I can't lokk nice? There might be doctors there.	0
Joey, get out of the fridge.	4
What is that?	2
For the ride.	0
Yeah, like in a cab...	0
Save it.	0
Monica, come on now. Let's go, baby coming.	0
I can't belive it, I'm gonna be an aunt. I'm gonna have like a nephew.	1
Here we go, here we go.	0
Rossy, Rossy.	0
Yes. Absolutely. A quality.	0
Oh, oh, a quality, good, because I was worried you guys were gonna be vague about this.	0
Oh my God! Calling from Rome!	2
So he's calling from Rome. I could do that. Just gotta go to Rome.	0
Oh, yeah, yeah, sure. We live in the building by the uh sidewalk.	0
You know it?	2
Hey, look, since we're neighbors and all, what do you say we uh, get together for a drink?	0
Oh, sure, they love us over there.	0
Ben! Ben! Ben!	1
Gimme 'em!	4
No! They are mine!	4
You stole them from me!	4
You stole them from me!!	4
Gimme them!	4
You just wanna each take one?	0
Yeah that seems fair. We never use them.	0
Well	0
Why don't you phase it out?	0
Yeah, I mean, come on Ross, no one will even notice. I mean they're probably not even listening!	0
They're not listening too me?	2
Of course they're listening to you! Everybody listens to you.	0
I think you look fine.	0
How about Joey... Pepponi?	0
No, still too ethnic. My agent thinks I should have a name that's more neutral.	0
Joey... Switzerland?	0
Plus, y'know, I think it should be Joe.	0
Which I'm not.	0
Stalin...Stalin...do I know that name? It sounds familiar.	0
Well, it does not ring a bell with me...	0
Might wanna try Joseph.	0
Oh yes! Bye Bye Birdie, starring Joseph Stalin. Joseph Stalin is the Fiddler on the Roof.	1
Are you kidding?	2
Okay, look.	0
Plus, I'm a doctor, and I had a monkey.	0
I'm not arguing with that.	0
You shouldn't be arguing over who gets credit, you should be arguing over who gets blamed for inflicting this horrible joke upon the world!	4
Now let it go!	4
The joke sucks!	4
It's your joke.	0
Is not.	4
I didn't!	1
Even when I found out umm, all right, well let's just say I found something out something about someone and let's just say she's gonna keep it.	0
Ooh, you nailed the Old Lady!	2
Yeah listen so, I thought I was getting better, so on my way home today I stopped by this guitar store and	0
No.	0
Yes!	1
Then don't touch one!!	4
Really? You'd-you'd do that for me?!	2
Yeah!	1
Thanks!	1
All right, we'll start off slow. The only thing you have to do tonight is come up with the name of your main character.	0
Done!	1
It's not.	0
Or Joseph.	0
Hi!	0
Hi! Hey, Pete you're back! Hey, check this out.	1
Wow! Skates!	1
Wow! You're a lot sturdier that Chandler. He crumpled like a piece of paper. So how was you're trip?	2
Well...	0
Oh, these are gonna go in my permanent collection.	1
You want some coffee?	0
Yeah, sure, that'd be great.	0
Regular or decaf?	0
Ah, which ever is closest.	0
Okay.	0
So ask me what I did today.	0
So what did you do today Pete?	0
I bought a restaurant and I would like you to be the head chef.	1
What?! Oh.	2
Hi.	0
Hey.	0
Where've you been?	0
At the vet.	0
She's not gonna make you wear one of those big plastic cones, is she?	5
Hey! He beat ya.	1
She says as time goes on, he's gonna start getting agressive and violent.	3
So what does this mean?	0
I'm gonna have to give him up.	3
Aww man! I can't believe I locked myself out again!	4
Oh my God! What happened here? Did you do all this?	2
I sure did.	0
But we haven't seen each other since then. Well I land in China, guess who's in charge of the dig.	2
May I come in?	0
Uh, yeah, if you want too.	0
Do	0
Yeah, sure?	0
So do I.	0
Okay Rach, before anything happens  I just want to lay down a couple of ground rules.	0
This is just about tonight.	0
I don't to go through with this if it's going to raise the question of "Us."	0
Okay?	0
The physical act of love.	1
What?! Are you crazy?	2
Oh so-so you weren't trying to entice me just now with your-your nakedness?	2
Oh God, you saw me?! Oh!	2
Ohh wow! I'm sorry, but Ross you kicked off your shoes!	2
Well, are you just hanging out with Ross?	0
It's, all good! Okay bye-bye Mon!  She's-she's gonna kill me.	5
Yeah, the phone was facing the other way.  And that goes back up there.	0
Ah Joey.	0
Joey Tribbiani.	0
Listen Joey, I got a problem, I just got a call from my dance captain, he's having a relationship crisis and can't get out of Long Island.	0
Listen Joey, seeing as you've got the most experience, I want you to take these dancers and show them the combination.	0
What?!	2
Aw come on Joey, it's easy.	0
Y'know, it's hand, hand, head, head,  up, pas de bouree, pas de bouree, big turn here, grand sissone, sissone, sissone, slide back, step, step, step, and jazz hands!	0
Have fun.	0
Bye.	0
Wow! Fortunately she has a	2
Oh, I so can't believe this! My uterus is an inhospitable environment? I was trying so hard to be a good hostess!	2
Oh, I can't believe my sperm have low motility because, let me tell you, when I was growing up they sure seem to be in a hurry to get places!	2
!	2
Hi there.	0
Hi.	0
Hi.	0
I'm sorry there wasn't better news from your test last week but I wanted to talk to you about your options.	0
Ok.	0
Above all, even though your chances of conceiving through natural means aren't great, you never know!	0
So, keep having sex on a regular basis.	0
Oh, DAMN IT!	4
Don't worry, after a while he'll tune it out.	0
Ok, given your situation, the options with the greatest chances for success would be surrogacy, or insemination using a sperm donor.	0
Ok.	0
Well, y'know, monogamy can be a, uh, tricky concept. I mean, anthropologically speaking-	0
Yeah! C'mon!	1
Alright. There's a theory, put forth by Richard Leakey-	0
Hi, is uh, is Carol here?	0
No, she's at a faculty meeting.	0
Oh, I uh, just came by to pick up my skull. Well, not mine, but...	0
Come in.	0
Thanks. Yeah, Carol borrowed it for a class, and I have to get it back to the museum.	0
What's it look like?	0
Kinda like a big face without skin.	0
Yes, I'm familiar with the concept. We can just look for it.	0
Ok.  Wow, you guys sure have a lot of books about bein' a lesbian.	2
Well, you know, you have to take a course. Otherwise, they don't let you do it.	0
Hey, hey, Yertle the Turtle. A classic.	1
Actually, I'm reading it to the baby.	0
The uh, the baby that hasn't been born yet? Wouldn't that mean you're... crazy?	2
You're not serious, I mean, you really... you really talk to it?	2
I have no idea what you just said.	0
Put Joey on the phone.	0
I'm trppd... in an ATM vstbl... wth	5
Yeah, like that thought never entered my mind.	0
and that was all before 10 o'clock.	0
The caterer rang and said it was going to be Chicken Kiev instead of Chicken Tarragon.	0
And then the florist phoned to say there aren't any tulips.	0
Oh, and the chilliest has carpel-tunel syndrome.	0
We're not gonna be	0
Whoa-whoa-whoa! Emily,  honey, okay?	2
Well, up yours too!	4
Where's Chandler?	0
Ah, he can't make it, he said he had to his...  Whoa-oh!	2
Joey? Joey Tribbiani?	0
Joey I can see you okay? You're hiding behind the coats.	0
Okay listen, just give me anything I can make two of.	0
Yeah! You wanna come?	1
Yeah!	1
Fine.	0
Fine.	0
Fine.	0
Fine.	0
All right. We're gonna go.  It's not for another six hours. We're gonna go then.	0
Hey.	0
Oh Willie's still alive!	2
What are you guys doing?	0
Oooh, I'm afraid that does not exist.	0
That's not true, there are great pictures of us!	2
No, there are great pictures of you standing next to a guy who's going like this	0
Oh my God! That's the creep that you're with at the	2
I don't know what it is, I just can't take a good picture.	3
Oh, here's a great one.	1
Yeah, I'm not in that.	0
I know, but look at me: all tan.	1
Hey, why don't you guys go get portraits done by a professional photographer.	0
That's a good idea! I bet they have one of those wind machines! Y'know	1
Yeah that's great! Next to that, Chandler won't look so stupid.	0
Chandler what do you say?	0
All right, but I should warn you, I'm not going. I'm going.	0
I still have so much to study for 213	3
I'm going to spend most of tomorrow doing practice exams	3
:O	2
Maybe I should try to finish comp apps and studying for Nature of Mathematical Reasoning tonight	0
when's that	0
I gave the rest of my DoubleShots to my friend, he needs them more than I do, he has 213, 18-290 signals and systems, and matrices all on Thursday	0
Nature of Mathematical reasoning is 1pm on thursday	0
why didn't he ask for change of schedule	0
I don't thikn they would have allowed it because he scheduled his own 213 exam	0
He originally had it for tomorrow but then that would have been 6 hours that he needed to study for 18-290 and matrices	0
So he pushed 213 back to Thursday	0
dnagggg	2
that's craszy	0
To find out more about the job.	0
Oh I see. And they just told you that you'd be hitting the emergency stop?	0
How much is the pay?	0
Also. Would you be able to come to NY memorial day weekend?	0
I do not know. I need to find out my schedule first.	0
Okay... did you hear back from anyone?	0
Have you tried engineeringjobs.com LOL	0
Engineerjobs*	0
So its playable rn	0
Almost	0
Once we have the person_1 and at least 2 Holy Flame, then he was gonna start playing the deck.	0
Ahh icic	0
Yeah	0
Plus I'mma get SP Sleimy Flares so I'll hand him my other 2	0
Oh btw, ordering shit soon (both Mint and location_0). Anything you want me to see if I can get it?	0
G1 clear	0
PRISM Image, Clear, right?	0
Is that the G1	0
http://images.yugiohmint.com/b/b1374606611BT090009.jpg	0
person_2	0
How many?	0
1	0
k	0
Lol	1
Anything else?	0
where are the CEE clusters?	0
In the far corner of person_3	0
oh yea I know	0
alright	0
The only person I've ever seen in here who's not a civE is person_4	0
And the cleaning guy	0
I went in there once with person_5	0
person_6	0
because there was a stapler	0
How'd you get in?	2
idk how he got in	0
Lol	1
door might have just be open	0
person_7 is here	0
I mean person_8	0
He wants his laptop charger	0
I'm aware 	0
Me too! I'm so happy for person_9!	1
yeah, and lol at her sending that text to person_10	1
person_11	0
What do you think will happen with location_1 and person_12 with location_2?	0
i think person_12 and location_1 should both leave	0
Yeah, I would not be mad at that	0
But if they fight over her then I feel like person_12 would win	0
Also I hate that person_13 and person_14 are fighting	3
Yeah, I don't really understand how location_1 has a case	0
Same, like I get that they are her parents but did she adopt location_2, if not she isn't blood related so I feel like not really gonna win	0
I mean, I guess I am	0
I just woke up	0
Uh do you have a charger? Like iPhone charger	0
Maybe? 	0
I'm on my way, I'll figure it out	0
What's the number thing?	0
It doesn't work, you should wait anyway, because I have to get a haircut today	0
Aight I'll message you if I'm going	0
It's so hard not to cry	3
What heppen	0
I lost another 3 set game	3
is ok person_145	0
Why does it hurt so much	3
everybody loses	0
because you are too competitive	0
I just dont want that game to be the decider	0
Like what if we could get bronze today but we don't bc I. screwed ipp so bad on the third set	3
well that wasnt your teams only loss	0
you win or lose as a team	0
And they kept on targeting me bc they know I'm weaker and it feels so awful	3
I hate playing on teams bc you let down so many people	3
I want my mistakes to be just my owm	3
im sure your teammates made mistakes too	0
oh	0
I hate these tournaments	3
then why do you play if you dont enjoy it	0
yeah but each problem set is worth like 1% of your grade	0
orly....well i like doing those more lol	1
but yeah i really dont have a number grade for my total it just says score_1	0
i guess i'll try to calculate it lol	0
oh his grade sheet is too hard to read	0
ann doesnt have a letter or a number total grade LOL	0
i THINK if i dont do this and only get score_2 on the final i'll still get score_3	0
gud enuf yoloswag	0
hey person_153 did you buy graduation tickets?	0
what do you mean? like extras?	0
yeah	0
you made a post a while ago that you were looking to buy	0
how much did you pay for them, if you did?	0
yeah 2 from person_156 but I'm always in the market	0
i'm trying to sell mine	0
lol	1
that person_153, flipping graduation tickets	1
Aight how much you want for them?	0
and how many do you have to sell?	0
i just wanted to know how much you paid for person_15's	0
idk if i'm selling the rest of mine yet	0
Oh well person_15 actually gave them to me free	0
lal	2
well	2
But I ended up giving him like $10 for each	0
i way way undersold the one I sold already	2
that's nice	0
person_16 said he thought 40-50 would be a reasonable first offer	0
*t	0
and I sure could use that x5	0
dang wow I wouldn't pay more than $30 but I'm not desperate	2
Wanna grab dinner	0
And then review lab?	0
sounds good	0
Cool see you at west Union	0
Let me know when you	0
Want to meet	0
i already ate, i'll come over though	0
Oh cool	0
See you soon	0
Hey person_17	0
Sorry about this but can I get an extension? :D	0
Hehe. Me too	0
I got an assignment due today and kinda stuck there	0
	0
I'll send you my part at latest tomorrow at 10 am	0
You're fine	0
Ok	0
Your deadline is Tomorrow night	0
Since we'll meet day_1	0
We have msd rq due on Tuesday...	0
What do you suggest?	0
Can I do the compiling part by Tuesday evening 6pm?	0
After the msd lecture....	0
Alright in that case I suggest you send this in the group discussion, and suggest we review it together at a later date	0
Personally I'm ok	0
With this	0
Okay thanks man	0
Yo get one of the buddyfight channels to get person_18 into a discussion. I want to hear that man say wow	1
Lol	1
XD	1
I'm tired	0
person_19?	0
Yeah	0
And do some social science homework too.	0
What class do you use person_19 in?	0
Algebra	0
Did you take the card? The one in the camera doesn't have any of the shots on it. I'm confused.	0
All of my cards are devoid of pictures.	0
I'm confused	0
The card that was in the camera yesterday	0
Aka the pictures you took lol	0
Exactly the one in it just has your pics on it.	0
Weird. Upload that, I'll check mine when I'm out of class	2
Like you checked all folders?	0
person_20. I'll put em on snaxandspex	0
Alright.	0
I'm going in class now and can't use my phone	0
Okay that's cool. They'll be there after.	0
kk	0
on a separate note, my friend says everything else is really good, so i'd like to confirm the first 2 months!	1
the last month (after the other guy moves in), im not so sure about yet	0
hope you understand!	0
hey yeah no I completely understand	0
we can def confirm the first 2 months	0
I'm asking person_154 for person_21's fb, that's the guy	0
I know he's moving here to start a PhD but he's her friend from college so I've not met him personally	0
When she gets back to me I'll try to put you guys in touch, but if you decide to move out in Aug that's cool	0
ahh ok so at least she knows him, not some random stranger (:	1
thank you so much!	1
do you want to prepare a sublease?	0
yeah no not at all	0
haha we wouldn't have been comfortable taking on random guy subletters either	0
so I understand your worry	0
haha great	1
sure. so should I just confirm it for may 15 - end of June for now?	0
so i did some research on subleasing stuff, and apparently the following should be present:/n1. duration of sublease/n2. name, home address and business address of subtenant (me)/n3. name, address of the tenant (you) during sublet period/n4. copy of proposed sublease which should contain tenant's original lease/n5. signature of landlord, tenant, subtenant	0
yup can confirm till whatever date person_154's friend is moving in	0
do you know the exact date?	0
Not yet, I'll finalize with her and let you know by tomorrow night. I'll prepare a draft of the sublease and you can sign it when you move in	0
sure!	1
thank you so much!	1
huh so you're still going to 100 iterations...	2
interesting	0
100?	2
in the SOR	0
only until iter 10 ish	0
oh what the shit	2
this is a lot of n	0
what?	2
oh do you mean your code?	0
no i'm running yours right now	0
SOR is only 100 until 10 ish	0
overall runs to get to 6.4 is around 818	0
person_157 got about the same but we might be wrong?	0
i dunno	0
Haha ok let me know	1
So I didn't go either lol	1
But I asked prof	0
He said he will give hw after this chapter gets over	0
Oh ok	0
and hw is from the textbook	0
Nice	0
He has to still decide which problems	0
Hehe thike	1
gonna work your ass off on tuesday though?	0
i am not sure... might have work of my own to do	0
i'd probably have to be on campus most of the day regardless	0
attending a watch party on tuesday night though?	0
there will probably be some	0
i might try to attend one	0
I'm wondering if I should go to one	0
since studying can be always put off till a later time...	0
true, tuesday might be the most interesting day of the week	0
other than the fact that it's the day the metro breaks down the least...	0
jk I actually made that up, and now I probably jinxed it	0
hopefully won't break down when you actually need it	0
haha	1
the watch party I think I might go to does require the metro	0
because it's in location_1	0
lol hopefully it won't stop you	0
we'll see	0
but other than that, how's life?	0
same old stuff pretty much	0
still in the proces of outlining	0
sounds like you have the general contours of the paper down, if you're in the outlining stage	0
some contours are there, i guess, others need to be more well defined	0
I don't see anything wrong with the function	0
Are you running my test on that?	0
yup	0
hmmmmmm	0
Maybe its my isqueue	0
But then it runs perfectly on C	0
I meamc1	0
Does your Autolab output say anything about it?	0
:^(	3
What class?	0
how people work	0
its a design class	0
required for design sophomores but like	0
there are only like 35 of them	0
and on SIO the class max says 45	0
but 43 people showed up on day one and the professor was like "whoa who are all these people"	2
so like idk whats up	0
idk if any of them are getting admitted or not	0
I love you	1
urghbrlmm	0
I love you	1
We had cake for my brother's birthday	0
Yum	1
That's late	0
12 days late	0
I want to kiss you	1
I know	0
I want to hold you in my arms and just enjoy the moment	1
I want to be held by you, safe and secure and happy	1
I want to run my hands through your hair	1
It's finally cooling down	0
We could fall asleep together	1
I want to lie my head on your chest and just listen to you breathe	1
To lean back and close my eyes and just feel you by my side	1
I love you	1
I love you too	1
I wish I was with you right now	3
:) 	1
That awkward moment when i am so sleep deprived I'm falling alseep and delirious at work	3
On the plus side things are 200x funnier	1
Lol true, but work will be over soon. In like 20 minutes right?	1
person_22	1
Then sleep and food	1
Not in that order	0
Do both at the same time	1
Not if you do it right :)	1
haha ok i just confirmed with her im taking it until that guy moves in	0
thank you!!!	1
yeah 2 mths is long enough to find other accomodation	0
but i dk who will hold you up for 1 mth though	0
it might be 1.5months not 2 haha but still better than nothing	0
dunno, see how first	0
the guy is her friend so its not some random stranger	0
if he seems fine i'll ask my parents if theyre ok with me just staying there	0
Hey person_23! Do u need more play testers?? My boyfriend is visiting and Id like to bring him as well. Is that OK?	1
YES!!!	1
The more the better!!	1
Awesome!	1
Haha	1
Thank you! :D	1
Haha alright, I'll msg u when I'm there time_1?	1
Sure!	1
Np! Wanted to give him a tour of ETC	1
Hahaha ok	1
Anyw I'll ttyl! Having rehearsals now	0
Gl!!!	1
haha it's fine	1
we can just exchange when they give graduation tickets out	0
God dammit my mom just said not to get it	4
aw rip	3
lol	1
If you want I can hang onto it for a couple days	0
Otherwise that's fine	0
So you can give it to someone else	0
Cool, no prob	0
Now I've got to remember to bring in that $10	0
Dude person_24 is just gonna stroke himself	0
Get person_25 or person_26	0
Or even person_27	0
spoke with my friend just now	0
we r indeed will get to those stage later on	0
but first, local	0
Lol	1
Alright	0
but we can still get into discussion or as a get international players as guest caster	0
I mean, game plays videos get alot less views than discussion ones	0
oh idk that	0
well regarldess, we will have quality gameplay + quality casters	0
Damn lol	1
example if we play shadow vs idk gc	0
i can invite u as guest caster, with me as main caster	0
similar to football matches where 1 caster do play by play and the other 1 do the analysis	0
mostly the guest will do the analyst	0
and match the clans in the video with the main clan of the guest caster	0
to get better insight	0
thats what i have in my head for now at least	0
Haha near the soccer fiel	1
You guys still waiting?	0
Yup!	1
Yeah haha near there	1
person_28 next bus need to wait super long leh	0
We're getting on 61c now!!	1
person_29 just reached LOL	1
Wtf	2
I got stuck in lafayette :///	3
Im here lol	0
:///	3
W:	0
I mean I drove to Sushi don	0
Waited in line	3
Ate then got stuck	3
i set up my college costs spreadsheet to take in my min income from the organization_0 $ sheet	0
thanks for keeping that updated	0
Well we now have work the 18th again for sure	0
oh cool	1
just the one day or the week of?	0
The week	0
oh that's fantastic	1
Probs $12	0
i'm glad person_187 pulls for his employees	1
mhm	0
I need to look for more people do the camp tho	0
sorry I don't know any kids :p	3
thank you person_149	1
This benefits me too :p	1
<3	1
hey person_158! ive a super random question: how many game programmers are there usually on a game?	0
its for a game design pitch im doing for a class haha we need to come up with a realistic budget but i dont even know whats a realistic number of programmers :/	0
20%	0
wha	2
for most project	0
thats a lot isnt it	0
indie team can go till like 60%	0
WHA	2
wait ok 60% of all the programmers or of all the staff	0
or the budget	0
so say a team of 10	0
in indie	0
6 would be programmers	0
oh so the entire staff??!	2
wowwww	2
ok hmm	0
in AAA	0
maybe 20%	0
ok i totally didnt expect that :O	2
but thanks!	0
haha np	0
