You should ah, you should just leave it.	0
I can't leave it! You gouged a hole in my dingy floor.	4
Eh! There you go.	0
You know that's nice, y'know we could put it back there after the surgeons remove it from your colon!	4
Hi.	0
Hi!	4
Hey!	1
Uh, Pheebs, about your mom...	0
Yeah?	2
How's that going?	0
So great. Oh, we took a nap today and my Mom fell asleep on my tummy and purred.	1
That's so sweet.  I'm gonna get some coffee.	0
Huh? What'd ya say Joe? I'll be right there.	2
Pheebs...	0
I just feel so, uhh.....	0
All right!!	1
I'm coming already!!	1
Really?! You think that will work?	2
Absolutely! And if it doesn't, can I get the extra ticket?	1
What the heck is that?	2
Hello.	0
Hey, Pheebs! It's Joey!	1
Hey, Joey!	1
Hey!	1
Ooh!	1
Ooh!	1
I just say someone on the... that looks just like you on the subway.	0
And I was gonna go over and say 'hi!' but then I figured, he doesn't care if he looks like you.	1
That just cost me four bucks. But uh listen, I just called to see how the chick and the duck are doing?	0
Ohh, they're having a	1
Kinda, but I've just been having way too much fun.	1
So you're not homesick yet?	2
No, I don't think so.	0
All right, the seven of us miss you.	1
No.	0
You'll see.	0
Liam, do me a favour. Tell the lads to go easy on Ross, it's his first time.	0
You don't say!	2
Good luck, babe.	1
Ross! Ross! Come on! Get in here!  Ross! Come on!	1
Ross, come on! Get in the bloody scrum! Ross, get in!	4
JOEY!!!!!!	1
I don't believe you spent my wedding fund on the beach house!	4
We're sorry honey, but we just assumed if you got married after you turned 30 you'd pay for it yourself.	0
Come on! Admit it! That was the best nap you ever had!	4
I've had better.	0
Okay! When?!	4
All right! All right! It was the best nap ever!	1
Uh-huh!	4
I've said it! Okay?! But it's over Joey!	4
I want to do it again.	4
We	0
Why not?	0
Fine! Do you want something to drink?	4
Sure, what do you got?	0
Warm milk and	0
Are you okay?	0
I need some milk.	0
Ok, I've got milk  Here you go...  Oh! Better?	4
No...	3
I'm so embarrassed, I'm the one he hit on!	2
Pheebs, if I had never met him this never would have happened!	0
I'm so sorry! No I'm sorry! No I'm sorry! No I'm sorry!	3
No, wait, oh, what are we sorry about?	2
I don't know...right, he's the pig!	3
...like a...	0
Yes, good! Ok...	4
Oh, but he was my pig man...how did I not see this?	4
Oh! I know!  It's because... he's gorgeous, and he's charming, and when he looks at you...	3
Ok, Ok, Pheebs...	0
The end.	0
Oh, God...	1
Should I not have told you?	2
No, no, trust, me, it's, it's, it's much better that I know.	0
Uh, I just liked it better before it was better...	3
Well, yes, it's kind've an unusual house.	0
It has umm, three beautiful bedrooms and ah, no baths.	0
But y'know, the ocean is right there.	0
Knock, knock, knock.	0
Ah, oh, hang on a second.  Come in, come in.  All right, so think about it, and call me back.	0
Are you ah, Phoebe Abott?	0
Ahh, yes.	0
Hi Phoebe Abott, I'm your best friends daughter!	1
You're Erwin's daughter?!	2
No, I-I mean your-your old best friend, here.  Lily, from high school. Remember?	0
Oh gosh, Lily, yes. Of course I remember Lily. I... Then you must be?	2
Phoebe.  Phoebe. Phoebe, yeah. She named me after you I guess.	3
Uh-huh. Wow! Well, look! There's Frank.	2
Dude, you have got to turn on	0
Let's go watch it at your place.	0
Nah, Monica's watching some cooking show. Come on, I don't want to miss when they were skinny.	0
Chandler, Chandler, y'know what we should do? You and I should go out and get some new sunglasses.	1
What? No, I want to watch this. . Did your cable go out?	1
No, that's	0
Joey, why is your cable out?	3
I uh, oh! Because, uh, I haven't really paid the bill	3
If you need money, will you please-please just let me loan you some money?	0
No, Chandler.	0
Look, forget about it, okay?	4
Look, I know things have been a little tight since Janine moved out.	3
Oh, was she hot.	1
Whoa ho.	1
I know!	2
Yeah, but, look I can handle it.	0
All right?	0
Look, I can listen to the radio, huh?	0
And Ross gave me this great book (holds up the	0
Sure.	0
Paid your phone bill?	0
Not so much.	0
Oh good, okay, I can't take it anymore.	0
I can't take it anymore.	4
So you win, okay?	4
Here!	4
Pheebs?	4
Flying a jet?	2
Better make it a spaceship so that you can get back to your	0
Hey everybody, Pheebs is here!	1
Phoebe!	1
Hey, Pheebs!	1
Phoebe, woo!	1
What?! What good is that gonna do anybody?	4
Well, it helps the bee look tough in front of his bee friends. The bee is happy and I am definitely not.	3
Now, y'know the bee probably died after he stung ya.	0
Aw, dammit!	2
Back on in 30 seconds people!	0
Hey, excuse me, would you mind switching with me?	0
Hey, no way, I'm in the shot man.	4
Come on man! You've been here all day!	4
Yeah, I-I'm taking pledges here, eh?	0
We're on in 3, 2,	0
Welcome back to our fall telethon. Now if you've been enjoying the performance of	0
Ah.	0
Yeah.	0
I go see my doctor tomorrow, I'll ask her about this.	0
Maybe she can give me a pill or something.	0
Yeah. Yeah, that's what you need a good...pill.	0
What are you writing?	0
Well, Joshua's coming in tomorrow and since I don't have the guts to ask him out, I'm going to sell him a coat and put this note in the pocket.	0
Oh yeah?  Joshua, give me a call sometime, guys like you  never go out of style... what did you throw away?	0
Hi guys!	1
Hey!	0
Hey, what have you guys been up too?	0
Oh, we went to see a collection of Victorian doorknobs and the Cupert-Hewitt museum.	0
Without me?!	2
My uncle dragged us there. But, it actually it turned out to be really interesting.	2
Yeah.	0
They were so ornate and beautiful, I mean look at that!	2
I can't believe you'd rather go out with him than me.	2
Would you excuse me, please? I'm trying to have a date here.	4
Fine, just stop thinking about me.	1
Can't do it, can you?	0
So I'm thinking about you. So what?	0
I don't get it. What do you see in this guy, anyway?	2
Well... he happens to be a very nice... guy....	0
I mean, come on, buddy, get a	0
Rachel, come on. Give us a chance.	0
Ross, it's too hard.	3
No, no, no... why, because it might get weird for everyone else?	0
Who cares about them.	0
This is about us.	0
Look, I-I've been in love with you since, like, the ninth grade.	0
Ross, you're like my best friend.	1
I know.	0
If we broke up, and I lost you...	5
Ohh, God.	3
Hello?  No she can't come to the phone right now.  Oh, right no problem. Okay, bye-bye.	0
Was it my work? Were they mad? Was it Jack? Did he yell?!	5
J-j-just relax, nobody yelled. Jack just was calling to make sure that	0
Thank God.	1
Yeah, she's fired.	0
...DUMB, DRUNKEN, BITCH!!!   Thank you, thanks.	4
Hey, here's a question; where did you guys get the finest oak East of the Mississippi?	0
Uh-huh, first you tell us where you got the prettiest lace in all the land.	0
I'm reading your ad.	0
Looks good, uh?	3
Yeah.	0
Stunning entertainment center. Fine,  fine Italian craftsmanship.	0
Oh my God, you guys are selling the entertainment center?	2
Why? I love that thing.	1
You want it?	0
Ahh, Gepeto, $5,000 dollars? Are you insane?	2
Hey, the ad alone cost 300 bucks!	0
All right look, I'm changing it to 50 bucks, or your best offer.	0
What kind of profit is that?! And you call yourself an accountant.	4
Nooo.	0
Oh. What do you do?	2
That's right Ross, I can see you in your new apartment!	0
And you can see me!	0
Same as yesterday,  same as the day before.	0
Is he doing his shark attack bit yet?	0
Nope. Op, wait! There he goes.	0
Hey!	0
Hey!	0
Hey!	0
What are you guys doing up?	2
Oh, we wanted to finish the crossword before we went to bed. Hey, do you know a six-letter word for red?	0
Yeah, I think that's wrong, but there's a Connect the Dots in here for you later.  Hey, how about maroon?	0
Yes, you are so smart!	1
Aww, you guys are so cute!	1
I know.	0
All right, I'll see you in the morning.	0
Okay.	0
I don't know.	0
But hey, I know we can decide.	0
Okay, I'm gonna ask you questions and you answer real quick.	0
Okay?	0
Okay.	0
What do you like better action or comedy?	0
Action.	0
Who would you rather sleep with Monica or Rachel?	0
Oh, I'm sorry. I forgot you had that whole Rachel thing.	2
I mean, this is unbelievable.	2
I know. This is really, really huge.	2
No it's not. It's small. It's tiny. It's petite. It's wee.	0
More than jewelry.	0
Hi! I'm Dr. Drake Remoray and I have a few routine questions I need to ask you.	0
Really? I've been dealing with Dr. Wells.	2
I know, but I'm a neurologist.	0
And just to be on the safe side, Dr. Wells wanted a more comprehensive overview of you status so he sent me.	0
Dr. Wells is a woman.	2
That was a test. Good response. All right, full name.	0
Clifford Burnett.	0
Date of birth?	0
16-Nov	0
Age?	0
Can't you figure that out based on my date of birth?	4
I'm a doctor Cliff, not a mathematician.	0
I'm 33.	0
Okay. And uh, are you married.	0
No.	0
Oh really? So, 33 and still single, would you say you have commitment issues?	2
Are all the questions this personal?	2
Yes.	0
Well uh if you must know I'm a widower.	3
Oh that's terrible. I'm-I'm really sorry.	3
Yeah.	0
Hmm. Do you sleep with women and never call them again?	0
No.	0
Chandler Muriel Bing. Boy, your parents never gave you a chance did they?	0
Hey! You guys, I'm writing a holiday song for everyone. Do you want to hear it?	1
Pheebs, that's great!	1
Oh, yay!	1
But y'know umm, Rachel doesn't rhyme with draddle.	0
What are you talking about? Lots of things rhyme with Rachel. Bagel. Mail. Jail. Bail. Able. May-pole.	0
All good, thanks.  Do you maybe have a nickname have like a nickname that's easier to rhyme?	0
Didn't your dad used to call you Pumpkin?	0
Okay.	0
Okay, I can do this.	0
I can tell her how I feel.	0
Just uh, just stand up straight.	5
Take a couple deep breaths.	5
Look confident.	5
Joey? What's up?	0
I uh, I just came by because I-I want to talk to you about something.	5
Okay what's up?	0
What I do do...is manage to uh, create an atmosphere of support for the people working with me.	0
I see. Nice sidestep on the do do thing by the way.	0
Hardest thing I've ever done in my life.	0
You gotta go!	0
Oh!	0
Okay, don't worry. You're ready.	0
Really?	2
Absolutely! Just fight all your natural instincts and you'll be great.	0
Now, Mom, everything's going fine, really.	0
Yeah, Ross is great.	0
He's uh, he's in a whole other place.	0
No, he's gone.	0
No no, you don't have to fly back, really.	0
What do you mean this might be your only chance?	2
Would you stop?	4
I'm only 26, I'm not even thinking about babies yet.	4
Where have you been?	0
Oh, just had a baby.	1
Mazel tov!	1
Oh, wow! I should get going. I-I got a date tonight.	1
Oh yeah! With who?	2
You know that girl I told you about who lives up in Poughkeepsie?	0
Not her.	0
Yeah, this is someone else I meet, and I-I can't decide between the two of them.	0
Y'know the one from Poughkeepsie, even though she's a two hour train ride away, is really pretty, really smart, and-and a lot of fun.	0
But this other girl, well, she lives right uptown.	0
Y'know she's, well she's-she's just as pretty, I guess she's smart, she's	0
If she's no fun, why do you want to date her at all?	0
Well, I-I want to give her another chance, y'know?	0
She lives so close.	0
And, at the end of the date, the other time, she-she said something that was... if she was kidding was very funny.	0
On the other hand, if she wasn't kidding, she's not fun, she's stupid, and kind of a racist.	4
Hey!	1
Hey! Ooh, how was your first day working at the restaurant?	1
Damn!	1
Oh here's a whole bunch.	0
"Oh, I mean she's gonna be at the wedding waiting for him and people will be whispering, ""Oh that poor girl."""	0
Then she'll have to come back here and live all alone.	3
Oh my God!	2
What?	2
There was a pregnancy test in the garbage, and it's positive. Monica's pregnant.  So I guess she won't be totally alone.	2
Hi.	0
Listen, I'm sorry about that whole thing with Roger.	3
It really wasn't right, and I, and I want to make it up to you, so umm, I brought you something that I think you'll really enjoy.	4
Now, this is just a loan.	0
Okay?	0
I'm gonna, I'm gonna want him back.	0
So...  I'm gonna go now.	0
I'm sorry, I thought I could do it and I can't!	3
All right, well why don't I go out with an ex-boyfriend and do Joey a favor?!	3
Hey, you wanna do Joey a favor, maybe you go out with Joey.	0
All right ladies, here's what we're gonna do.	0
I-I wanna be with her,  I like her.	4
Oh, that's fine! Go with your instincts, go with your instincts.	1
Wait, now, what am I doing again?	2
Come on! Would you please pay attention, I could wake up at any moment!	4
Hi, I'm Joshua, I'm here to pick up Rachel.	0
No-no-no, that' not Joshua.	4
What do you want from me, I've never met the guy.	2
So anyway, Rachel, I'm sorry you can't stay,  but the rest of us have a	3
How do I look?	0
Oh, uh, I... don't... care.	0
Ok, now, remember, no trading.	0
You get the pretty one, I get the mess.	0
Hi, Joey. Well well, look what you brought. Very nice.	1
...And what did you bring?	0
She's checking the coats.	0
Joey, I'm gonna go wash the cab smell off my hands.	0
Will you get me a white Zinfandel, and a glass of red for Janice.	0
Janice?	2
Oh.... my.... God.	2
Hey, it's Janice.	0
Well, okay so, I don't have it all worked out quite yet. Just don't say anything to Rachel, please?	4
Rachel is one of my closest friends.  Although, being the only one who knows anything about this does makes me feel special. Okay!	0
Okay, stop-stop! Phoebe?!	3
Hey Rach!	4
What was that?!	2
Sorry, mix up. Hey, how was the movie?	0
I haven't seen it yet!	0
Well then you'd better hurry! The Angelica! Go! Go!	2
No	4
Pheebs! Hey Pheebs!	1
Uh, okay, Pheebs?	0
Yeah?	0
Umm, y'know how the other day you were talking about how you didn't get to go to London and how you were kinda feeling left out?	0
Yeah?	0
All right, well, we felt really bad about that so we decided we should all take a little trip together!	1
Ohh, that's so nice! How great! Well, where? Where's the trip?!	4
Well, we thought we would all go to a picnic , in Central Park!	1
Yeah, all of us! All day!	1
That's not a trip!	2
I just came from the park!	4
What are we gonna high five about at the stupid Central Park?	4
"""Well, it's right by my house, all right!"""	4
Well, I'm gonna go home and bask in the triumph of my Central Park idea.	4
Ho-ho-hold on a sec there, Mr. Kissey!	2
Y'know, I've been meaning to talk to you about this whole, little, new European thing you got going on, and I just need to tell you that it makes me very uncomfortable and I just... y'know... stop it!	4
I was just trying to bring a little culture to the group.	3
Is she in there?	0
Yeah. She's putting her down now, that's her.	0
Oh it's all right.	0
I'm guess I'm just done with the whole dating thing.	3
It's one more thing in my life that's suddenly completely different.	3
This is hard.	3
Yeah I know.	0
On the other hand in um, in about seven months you're gonna have something that you're gonna love more than any guy you've ever gone out with.	0
Just wait.	0
Wait until uh, wait until the first time your baby grabs your finger.	1
You have no idea.	1
Thanks sweetie.	0
You wanna, you wanna grab some coffee?	0
Oh no, I think I'm gonna go home and eat ten candy bars.	3
Hey, I thought I cheered you up.	0
Oh you did, there are twenty in here.	0
Right. Good night.	0
Good night.	0
Hi	0
Hi!  Hey mom.	1
This is such a great party! 35 years. Very impressive, do you guys have any pearls of wisdom?	1
Jack?	2
Why would you serve food on such a sharp stick?	2
That's a good question, dad. That's a good question	0
Congratulations you two!	1
Thank you...we're so excited	1
And also, congratulations on your wedding.	1
Wha... What?	2
Look at this clown!	1
Get out of the way jackass!	4
That	0
What are they doing out here? The coast's all the way over there.	2
Hey!	4
Hey! Check it out! This is unbelievable! Joey has been holding his breath for almost four minutes!	2
Dude! What are yo... you trying to kill me?!	0
Ow!	4
Really?! Well, it's just like everyone else's apartment. It's got rooms, walls, and ceilings.	0
Well, I just wanted to see where you lived. Now, give me the tour.	0
Oh my God! Oh my God!	2
Ah well, this is the living room.	0
All right. This is the kitchen.	0
The bedroom. Well it's pretty much your typical...  bedroom.	0
We're still on this side of the door.	0
Ha-ha	1
Yeah, but I didn't get to see it.	3
Oh shoot! Maybe next time.  Thanks for a lovely evening.	0
So um, who was she?	1
Oh,  that was the blind date that I told you about, she called and switched it to today.	0
Did you like her? And I'm just asking as a friend, because I am totally fine with this.	0
Well, you seem fine.	0
Well, I don't think this, y'know.	0
Yeah, no, I'll get one of the other girls to do it.	0
Oh, this will be so much fun!	1
Hey!	2
Are you excited?	1
Yeah! Hey, do Monica and Rachel work there?	0
Ok, so now we need, um sage branches and the sacramental wine.	0
All I have is, is oregano and a	0
Um, that's ok!  Ok. All right. Now we need the semen of a righteous man.	1
Ok, Pheebs, you know what, if we had that, we wouldn't be doing the ritual in the first place.	0
Can we just start throwing things in?	0
Ok, yeah, ok.  Oh, OK.	0
Ok, Barry's letters. Adam Ritter's boxer shorts.	0
Ok, and I have the, uh receipt for my dinner with Nokululu Oon Ah Ah.	0
Look, here's a picture of Scotty Jared naked.	0
Hey he's wearing a sweater.	2
No.	0
And here we have the last of Paulo's grappa.	0
Hey, Rachel, isn't that stuff almost pure...	0
Mona?  Okay, if I were a salmon shirt, where would I be?	0
I am so sorry I spilled wine all over your shirt.	3
Oh, it's okay.	0
No, it's still wet.	1
Let me get it out before it sets.	0
Ooh, I have something you can wear.	0
Here.	0
Oh umm, I-I don't know if I want to wear a woman's shirt.	3
No-no that's a man's shirt.	0
It's awfully pink.	0
Oh, it's perfect!	1
How about you?	0
It's a kitchen slash bathroom.	0
All right, I see what you guys are saying. I'll uh, I'll go downstairs and fill out an application.	0
He knew we were trying to get rid of him. He knew!  You think we could get a bathtub in our kitchen?	2
Let's get the show on it!	1
Okay, let me just get a cup of coffee.	0
Oh Rachel, I know the best coffee house and it's sooo close.	0
Closer than here?	0
Oh, hey, look, I found coffee!  Okay, let's skedaddle.	0
Wait, I'm not just gonna drink somebody's old coffee.	0
Okay, your highness.	0
Um, Rachel I'm really sorry.  That's okay, do you wanna get back together?  Yeah, okay.  Did anyone else hear that?!	2
So how did you know I was even here?	2
Your mom called me. So is this her?	0
No, this is a loaner.	0
I'm sorry you had to do this by yourself.	0
I wasn't by myself. I had a doctor, a nurse, and a helper guy.  So, did you see who won the game?	0
Yeah, the Knicks by 10. They suck.	0
Yeah, they're not so bad.	0
I'm sorry I won't be able to make it to your imaginary wedding, but I'm	0
I know. I know. I panicked, I panicked. I didn't want him to start yelling at me like I was some '74 Latour.	2
It's Lafite. The '74 Latour is actually drinking quite nicely.	3
All right here he comes. I'm gonna do this, I'm gonna tell him, I'm gonna be strong.	5
I just called a friend of mine.	0
Yeah?	2
I think I may be able to book	0
Really?!	2
What is it sweetie?	1
There's not gonna be a wedding. Ross and I are not getting married.	3
I'm sorry daddy.	3
I don't believe this!!	0
Oh now daddy, stay calm. Please.	5
Stay calm?!!	4
How do you expect me to stay calm?!	4
This is unacceptable Rachel!	4
And I wanna know why?!!	4
Is it because that punk Ross won't marry you?!	4
That's it!	4
Is that it?	4
Yes. Yes, he says I'm damaged goods.	3
So, you're like a zillionaire?	2
And you're our age. You're our age.	2
Y'know what, you should like, you should buy a state and then just name it after yourself.	0
What like Pete Dakota?	0
Yeah, or, or, or, Mississ-Pete.	0
Oh, oh, I got it! Pete-Chicago.	0
That's not a state Joe.	0
Oh, and Mississ-Pete is?	0
I got to go, so ah, I'll see you guys later.	0
Okay.	0
You're our age!	2
So ah, we on for tomorrow?	0
Absolutely!	1
Now get out of here you!!	1
Okay, I'm running out of places I can touch him!	4
Look, is there something wrong with me?	3
I mean why am I only attracted to guys where there's no future?	3
Either they're too old, or they're too young, and then there's Pete who's-who's crazy about me, and who's absolutely perfect for me, and there's like zip going on!	3
I mean, seriously, does it sound like something's wrong with me?	3
No.	0
Okay, I'm gonna go get Frank.	0
So, we're walking down the street and I turn to you and I say, 'Hey, let's go hang out at Totally Nude Nudes,' remember?	0
And then, and then, you turn to me and say, 'Nah, let's just hang out at your place.' Well, that was a nice move dumb ass.	1
Yeah, I think it was better when you guys were sad. Hey, uh, remember the roller blades?	0
You know what else I'm not gonna miss?	4
"""I'm Monica."	4
I wash the toilet 17 times a day.	4
"Even if people are on it!"""	4
"""Hi I'm Rachel, is my sweater too tight? No? Oh, I'd better wash it and shrink it!"""	4
"""I'm Monica, I don't get phone messages from interesting people. Ever!"""	4
Hey! I call her!	1
"""Oh my God, I love Ross! I hate Ross! I love Ross! I hate Ross!"""	4
"""Oh my God, I can't find a boyfriend!"	4
"So I guess I'll just stumble across the hall and sleep with the first guy I find in there!"""	4
Yeah, we should get a move on if we wanna make those dinner reservations.	0
Item J437-A, color: winterberry.	0
Hi umm, listen come here, come in.	0
I'm so-so sorry about yesterday.	3
I-I'm really sorry.	3
It's just that I	1
Listen Ross, you don't have to apologize. I understand why you were there.	0
You do?	2
Yeah, you still have feelings for me.	3
And-and to be honest, I-I still have feelings for you.	1
And I wish that we can work it out Ross, but we can't.	3
It's too complicated with you and Rachel and the baby, I-I just... It just wasn't meant to be.	3
Oh God you're right.	1
Ross, we...we have to be strong. Okay, I-I'm gonna go.  Can I? To remember you?	3
No.	0
I'm telling you, if you want to take care of that thing, you should go to my herbal guy.	0
Thank you, but I want to remove it Pheebs. I don't want to make it savory.	0
Y'know when girls sleep with guys with weird things on their body, they tell their friends about it.	0
Gimme this.	0
Hi! Okay, don't be mad at me, but I couldn't resist.	0
Brides magazines?	2
Yes, and I know that you'd say no if he asked you, but I'm sorry; how great would you look walking down the aisle in this Donna Carin.	0
Oh, you so would! Oh, you should get that anyway.  Like for clubbing.	3
It is so weird, I know what I said, but uh, this morning, I was lying in bed I was, I was imagining what it would be like to say yes.	2
I know it's a little sudden, and it's a little rushed, and it's totally not like me to do something like this, but that doesn't mean I can't.	1
Right?	1
I mean I'm-I'm crazy about Pete, and I know that we want the same things, and when I thought about saying yes, it made me really happy.	1
Oh my God.	2
I know.  I need more pie.	0
Hey Mon umm, if you do get married, can I bring two guests?	0
You didn't break up with that fireman?	2
No, that was my way of telling you.	0
Well, it turns out he's incredibly sensitive, he keeps a journal and he paints.	0
He even showed me charcoal drawings that he drew of me.	0
Wow!	2
Yeah, well he'd prefer water colors, but y'know, he has easy access to a lot of charcoal.	0
So then, are you going to dump Jason?	0
Well, yeah, because I have to break up with someone, and... Okay so Jason is sensitive,  but now so's Vince  Plus, Vince has the body y'know?	0
So... It's really just about the math.	0
Ok, so it's a tie again, 41 to 41.	0
Ok, look! Enough is enough!	4
No, I have just to have two more points to beat him!	1
Monica, that was also true an	0
I can't just walk away! I've put in four hours!	4
You knew this about me when you married me!	0
You agreed to take me in sickness and in health.	0
Well, this is my sickness!	4
Oh yeah-yeah, the lobster.	0
Yeah, I mean I was up sick all night.	0
Yeah me too, all night.	0
Really?! How come we didn't cross paths?	2
Yeah well that's because uh...I stayed in my room. Yeah, you don't want to look in my hamper.	0
I can't believe there is a naked hooker in there!	2
Wait! Wait! Maybe she's a hooker	2
Yeah, okay let's leave these two alone.	0
Fine! Then you tell Roger because he was really looking forward to this!	4
So.	0
So.	0
I just thought the two of us should hang out for a bit.	0
I mean, you know, we've never really talked.	0
I guess you'd know that, being one of the two of us, though, right?	0
I know, I probably shouldn't even tell you this, but I'm pretty much totally intimidated by you.	5
Really? Me?	2
Oh my god, are you kidding?	2
Ross is so crazy about you, and I really wanted you to like me, and, it's probably me being totally paranoid, but I kinda got the feeling that maybe you don't.	4
Well, you're not totally paranoid.	0
Oy.	1
Um, ok, uh, oh god, um, when you and uh Ross first started going out, it was really hard for me, um, for many reasons, which I'm not gonna bore you with now, but um, I just, I see how happy he is, you know, and how good you guys are together, and um, Monica's always saying how nice you are, and god I hate it when she's right.	3
