also I was the point person on my company's transition from the KL-5 to GR-6 system.	0
You must've had your hands full.	0
That I did. That I did.	0
So let's talk a little bit about your duties.	0
My duties?  All right.	2
Now you'll be heading a whole division, so you'll have a lot of duties.	0
I see.	0
But there'll be perhaps 30 people under you so you can dump a certain amount on them.	0
Good to know.	0
We can go into detail	0
No don't I beg of you!	5
All right then, we'll have a definite answer for you on Monday, but I think I can say with some confidence, you'll fit in well here.	0
Really?!	2
Absolutely.  You can relax	0
But then who? The waitress I went out with last month?	2
You know? Forget it!	3
No-no-no-no, no! Who, who were you talking about?	2
No, I-I-I-I don't, I actually don't know	5
Ok!	0
All right, well...	0
Yeah, sure!	0
Hey, Mon.	0
Hey-hey-hey. You wanna hear something that sucks.	0
Do I ever.	1
Chris says they're closing down the bar.	3
No way!	2
Yeah, apparently they're turning it into some kinda coffee place.	0
Got me.	3
Can I get a beer.	0
Hey, did you pick a roommate?	0
You betcha!	1
Is it the Italian guy?	0
Um-mm, yeah right!	1
Oh my God, oh my God! Poor Monica!	2
What, what, what?!	2
What?!	2
He was with her when he wrote this poem.	0
Look,  'My vessel so empty with nothing inside.	0
Now that I've touched you, you seem emptier still.'	0
He thinks Monica is empty, she is the empty vase!	2
Oh, totally. Oh, God, oh, she seemed so happy too.	3
Done.	0
Hey!	2
Hi!	1
What are you doing here?	2
Ah y'know, this building is on my paper route so I...	0
Oh.	0
Hi.	0
Hi.	0
How'd did it go?	0
Oh well, the woman I interviewed with was pretty tough, but y'know thank God Mark coached me, because once I started talking about the fall line, she got all happy and wouldn't shut up.	1
I'm so proud of you.	1
Me too!	1
Listen, I'm ah, I'm sorry I've been so crazy and jealous and, it's just that I like you a lot, so...	3
I know.	0
Yeah.	0
Yeah.	0
Ameri-can.	0
Ameri-ccan.	0
Ameri-can. Y'know it's a	0
Everybody!!	2
Good job Joe! Well done! Top notch!	1
You liked it? You really liked it?	2
Oh-ho-ho, yeah!	1
Which part exactly?	0
The whole thing! Can we go?	0
Oh no-no-no, give me some specifics.	4
I love the specifics, the specifics were the best part!	1
Hey, what about the scene with the kangaroo? Did-did you like that part?	0
I was surprised to see a kangaroo in a World War I epic.	2
You fell asleep!!	4
There was no kangaroo!	4
They didn't take any of my suggestions!	4
That's for coming buddy.	0
I'll see you later.	0
Don't go!	3
I'm sorry.	3
I'm so sorry!	3
Look!	2
This guy fell asleep!	4
He fell asleep too!	4
Be mad at him!	4
Or, call an ambulance.	4
Okay, look, I think we have to tell Rachel she messed up her dessert.	0
What?! What is with everybody? It's Thanksgiving, not...Truth-Day!	4
Yes, and it is my dying wish to have that ring.	0
See, if I'm not buried with that ring then my spirit is going to wander the nether world for all eternity	0
Okay, that's enough honey!	0
I don't know.  Let me see the ring.	0
Great! Okay, here.	1
All right.	0
Thank you. Thank you. Thank you!  And	1
What've you been up to?	0
Oh, you know, the usual, teaching aerobics, partying way too much.	0
Oh, and in case you were wondering, those are my legs on the new James Bond poster.	0
Can you hold on a moment? I have another call.  I love her.	1
I know.	0
I'm back.	0
So, are we gonna get together or what?	0
Um, absolutely. Uh, how 'bout tomorrow afternoon? Do you know uh, Central Perk in the Village, say, five-ish?	0
Great, I'll see you then.	0
Ok.  Ok. Having a phone has finally paid off.	1
"Even though you do do a good Bob impression, I'm thinkin' when she sees you tomorow, she's probably gonna realize, ""Hey, you're not Bob."""	0
I'm hoping that when Bob doesn't show up, she will seek comfort in the open arms of the wry stranger at the next table.	0
Ok, pure evil , horny and alone . I've done this	4
Nobody!	4
Nobody respects the bucket!	4
You wouldn't believe what people put in here!	4
Look!	4
Okay, does this look like a garbage can to you?	4
No.	0
This is my wedding.	0
All right, y'know what? We really are late! Let's go! Let's go! Let's go!!	4
Fine. You'll-you'll watch it on video when we get back.	0
Here you go Phoebe! Here you go Phobo! Phewbedo! Phaybobo.	1
Thank you.	0
Thank you.	0
All right, let's go! Bye, Pheebs!	1
Bye, Pheebs!	1
London baby!!	1
Oh, do you need a hug? You don't have to bring me anything!	1
Hey!	0
Hey! So Estelle lined up a bunch of auditions for me tomorrow and I'll have my health insurance back in no time.	1
What?!	2
Nothing!	0
Well, I-I got this blinding pain in my stomach when I was lifting weights before, then I uh passed out and uh, haven't been able to stand up since.	5
But um, I don't think it's anything serious.	0
This sounds like a hernia. You have to... you-you go to the doctor!	2
No way! 'Kay look, if I have to go to the doctor for anything it's gonna be for this thing sticking out of my stomach!	5
Why did I have to start working out again?  Damn you 15s!	4
I love your place! Where is this guy from?	1
Uh that's an eighteenth century Indian artifact from Calcutta.	0
Oh wow! So, you're more than just dinosaurs.	2
So much more.	0
Well, well to sum up, we're having fun, you look young.	0
Okay	0
But that's not enough. So... So...here's a key to my apartment.	0
Really?!	2
Really.	0
You don't think this is too fast.	0
Get Out!	4
Ross, can I talk to you for a minute?	0
Yes, please!  So, what's going on?	0
Uh, well... Joey and I broke up.	3
Oh my God, wh-what happened?	2
Joey is a great guy, but we're just... so different! I mean, during your speech he kept laughing at homo erectus!	3
I knew that was him!	4
Anyway I just, uh, I think it's for the best.	3
Hey, you ok?	0
I guess.	3
There was hum...  there was another reason that I thought it was time to end it with Joey.	0
I started to realize that I was having feelings for someone  else.	0
Ok Geller. Last day of the conference, you know what happens to the keynote speaker.	0
Oh, professor Clerk we're kind of in the middle of a conversation, here.	0
Yeah, can you guys just throw him in the pool later?	0
Or we could throw you both in	1
Ok, gentlemen!	4
Please!	4
Aren't we a little old for this?	4
I mean, we're scientists, right?	0
We're academics.	4
And most importantly I... you-you will have to catch us first.	1
GO, GO, GO!	1
Go, go, go!	1
Oh yeah, now everybody wants to be under this hat!	1
What's with all this sand?	2
Oh, yeah, Bob said there might be flood damage.	0
Yeah, either that, or he has a really big cat.	0
Okay, see that blind guy right there? I'm gonna bash his head in later.	4
Oh umm, my big scene is coming up. Big scene coming up.	1
"If you said, ""Big lima bean, bubbling up."" Would she understand the difference?"	0
Rach? What are you doing?	0
Oh boy, I just can't watch. It's too scary!	5
It's a diaper commercial.	0
Oh yeah well, you know me, babies, responsibilities, ahhh!!!	5
Pizza delivery!	1
I'll get it! I will get that!	1
Hi!	1
Hi!	1
Hey, you wanna get something to eat or uh, do you wanna see how long we can throw this ball back and forth? Huh?	0
Uhh, the ball thing.	0
Yeah?	0
Hey Ross, wouldn't it be great if we could go two straight hours without dropping it?!	1
Uhh,	0
Okay!	1
Uh-oh.	5
What?	0
I have to pee. And Rachel's in the bathroom!	3
Man, I didn't think we were gonna make it!	2
I know!  Don't switch hands, okay?	5
Hey.	0
Hey!	0
How did it go with Erin?	0
Oh, unbelievable! We had the best time!	1
Yay!! Oh so, you're not, you're not mad at us anymore?	1
No!	1
No!	1
No!	1
You guys were totally right!	1
This is so much better than the first time we went out.	1
Y'know?	0
That was so awkward, we were really nervous.	0
Didn't you sleep together?	0
Yeah, that really calms me down.	0
And!	1
We have so much in common!	1
She loves sandwiches, sports, although she is a Met fan, not much of an issue now but if we were ever to have kids, well that's a	1
Oh my God! Listen to you talkin' about having kids. Oh my Joey.  Oh, please don't get married before I do.	2
Okay.	0
How does she do that?	2
I cannot sleep in a public place.	0
Would you look at her? She is so peaceful.	1
Oh! What what what! ...Hi.	2
It's okay, y'know, you just nodded off again.	0
What's going on with you?	2
I got no sleep last night!	4
Why?	0
Oh, and deaf.	0
So they're constantly, like, having to reassure each other that they're having a good time.	0
Well, if you want, you can stay with Rachel and me tonight.	0
Thanks.	1
It's just her water breaking. Calm down, will you?	0
Water breaking, what do you mean? What's that, water breaking?	2
Breathe, breathe, breathe.	0
Are you insane? I mean Joey, is going to kill you, he's actually going to kill you dead.	2
Okay! You don't think I thought of that?	4
How can you not know which one?	2
I mean that's unbelievable.	1
I mean, was it Gina?	0
Which one is Gina?	0
Dark, big hair, with the airplane earrings.	0
No, no, no, that's Dina.	0
You see you can't tell which one is which either, dwha!!	2
I don't know, you thought 'See you Saturday' was funny.	0
Look honey, Mark is in fashion okay, I like having a friend that I can share this stuff with.	0
You guys would never want to go to a lecture with me.	0
Pa-haa!! I would love to go with you.	1
Really!?	2
Yeah, hey I-I have clothes, I even pick them out.	0
I mean for, for all you know I could be a fashion..... monger.	0
Okay. Honey, I would love for you to go with me.  What?	1
What should I wear, now I'm all nervous.	5
: I know, we did it!! Hey, that was incredible, huh?!	1
I know, it was amazing! I mean, we totally nailed it, it was beautiful.	1
: Thank you, listen, thanks a lot Tribbiani, . Oh my God, look at the time, I gotta catch the bus to the ball.	1
Oh well, okay, good luck.	1
: Yeah.	0
Unless you wanna practice the Foxtrot again? Or-or the Tango?	0
: Ahh, thanks but no. You see I-I think I'm ready to dance with girls.	0
Okay.	0
: Yeah.	0
Go get 'em Treeger.	0
: Right.  Hey, ahh, you wanna come? Marge has a girlfriend.	0
Really?	2
: Yeah, you could dance real good with her, she's the same size as me.	0
No, I'm good.	0
Oh God, this is so nerve wracking! How-how do you do this?	2
Well, unfortunately, I don't get many callbacks so	0
Is it a good sign that they asked us to hang around after the audition?	2
Who knows?	0
Okay uh, we have narrowed it down to Raymond, Ben, Kyle, and Joey. The rest of you, thank you very much.	0
Yes!! I knew it!!  Bye-bye! So long! Later!	1
Oh this is great! I might actually get to play Ben's dad!	1
Yeah!	1
Actually, that can't happen.	0
Yeah because you all have such different looks, we're putting you with Raymond and Kyle with Ben.	0
So it'll be either you two  or you two.	0
Man, this is gonna be kinda weird.	3
Yeah, it is.	0
No, we-we're gonna be like best friends, that's why it's gonna be weird.	0
Okay, come on, I can't get married until I get something old, something new, something borrowed, and something blue.	3
Okay, all right, all right, all right! Okay!  Okay, here's something, here's something blue and new.	1
Please!	4
Are you kidding?	4
I-I hurt three huge men, I gave a guy a bloody nose... I mean I-I'm not proud of it but, I really am.	4
And it's all because of you, wonderful, amazing you.	1
I think you've got concussion.	5
No, no, I'm serious. Thank you.	1
You're welcome.  I'm sorry. Did I hurt you?	5
It's worth the pain.  Y'know what, you know what? It's not.	3
Wow! That Mike thing was interesting! I don't know what's gonna happen with Phoebe and David.	2
"I do! Want a hint? huh? ""I do""  ""I do""."	1
Ok, I'm sensing that this is some kind of word play, because you are pink with barely controlled glee.	0
David is going to propose to Phoebe.	1
What?  Why?	2
Chandler, we have talked about this.	4
You are not supposed to give people advice!	4
Now couldn't you just have made some sort of inappropriate joke?	4
I	0
They've only been going out for a few weeks and Phoebe is completely hung up on Mike!	4
"She'll say ""No"", David's heart will be broken, it will be too hard for them to recover from and then Phoebe will end up alone"	4
Man, that's some	2
Oh, that's not what you want...	0
This is my father, Paul Stevens. Dad, this is Ross Geller.	0
It-it's great to meet you Paul.	1
I usually prefer Elizabeth's boyfriends to address me as Mr. Stevens.	0
Of course, of course, Mr. Stevens.	0
So Ross, what your problem?	4
Eh-wh... Excuse me?	2
Why can't you get a girlfriend your own age?	4
That's funny. Umm....  It's not funny.	5
I	0
Okay.	0
I can, I can see that.	0
Umm, but I think if you give me umm, one chance I can, I can change your mind.	5
Okay.	0
What?	0
Okay. I'll give you one chance to change my mind.  You got one minute.	4
Daddy!	2
Oh well, it's not on TV yet.	0
Well, then it's not on the wall yet.	0
Okay, fine, I will bring you a tape, huh?	0
So umm, now do you have any of Matt Lauer's clothes here? Maybe? Just ones that haven't been cleaned yet?	0
Ooooohh!	2
Oh yeah, I'm sure.  And all of a sudden his hands weren't the problem anymore.	0
Was it...?	2
Oh, boy scouts could have camped under there.	0
"""Ooo,"" what?"	2
Uma Thurman.	0
Oh!	2
The actress!	2
Thanks Rach.	0
So what are you gonna do?	2
You have to tell her!	1
You have to tell her!	1
It's your moral obligation, as a friend, as a woman, I think it's a feminist issue!	4
Guys?	4
Guys?	4
Oh, yeah, you have to tell her.	0
Feminist issue. That's where I went!	0
She is gonna hate me.	5
Yeah, well...	0
Will you marry me?	5
It's the big night! We wanted to wish you good luck!	1
Yeah, yeah you have the ring?	0
Yeah, right here in my pocket.  Pheebs?	0
Oh! Oop!	2
Okay, now will you guys get out of here? I want this is to be a surprise and she's gonna know.	0
Yeah-yeah you guys. Get out of here!	0
Hi guys.	0
You are beautiful.	1
Oh, thank you!   What's going on?	1
We're just really...very excited about this charity event that we have to go to.	0
Okay umm, Ross?	0
I'm-I'm really warm, so I'm going to be taking off my sweater.	0
Now, I'm just letting you know that this is	0
Yep! That's hilarious!	1
I'm sorry. I'm done. I'm done.	0
Y'know, last night was embarrassing for you too.	0
No, not really. I mean you've seen me naked hundreds of times.	0
Uh-huh. But it was a first for the rest of my building.	0
Okay. All right, that's true! But y'know I just don't embarrass that easily.	0
What?! You totally get embarrassed!	2
No, I don't! Ross, I think I'm just a more secure person than you are.	0
Is that so?	0
Yeah.	0
I can't believe it!	2
I did it!	1
I rode a bike!	1
I never thought I'd be able to do that!	1
Thank you Ross.	1
Oh hey, don't thank me, thank yourself. You're the one who faced her fears and ultimately overcame them.	1
Hey, both you guys should be up there with me.	0
I mean, you two are-are my... I mean, I'm lucky to have just one good	0
Thanks man.	0
I gotta go check something over here.	0
What a baby.	3
Total wuss!	3
Okay, we have a lot of options here, a number of prototypes for you to try on.	0
Wow! This looks great!	1
Yeah! Okay, this one is a mushroom cap.  Umm, this one is made of bologna.	1
You kissed another woman!	4
Call it even?!	0
Okay!	1
Well, I'm gonna go get these  in some water.	0
Wait you stole those from these people's wedding?	2
No-no, I took them from the hotel lobby.	0
Yeah, they think they can charge me for some dirty movie and a bag of Mashuga nuts, they got another think coming.	4
Hey!	2
My sweater!	2
I've been looking for this for like a month!	2
Oh my God!!	2
Oh my God!	2
Happy?! Is that what I'm supposed to be Vic? Happy?	4
Well, why don't you tell me what you're supposed to be!	4
Huh?	2
Because I sure as hell can't figure it out!	4
I talk to you and nothin'.	4
You look at me, and it's nothin'.	4
Nothing.	4
Tasty! I'm really starting to feel like you guys have a history, it's-it's nice.	1
I have a question about this scene.	0
Yes?	0
Peel the onion. First of all, he's good looking.	0
Yeah.	0
I think my character's gonna need a little bit more of reason than that.	0
Oh, hey, how about this one.	0
Ah, it's says so in the script!	4
Y'know ah, I-I don't know why my character likes you either, I mean it says in the script here that you're a bitch.	4
It doesn't say that in the script.	4
It does in mine!	4
I can't	4
Yeah! You gotta tell a girl before you tape her. Such a rookie mistake.	4
Y'know who has a great video camera?	0
Greg and Jenny?	0
Do you still wanna call 'em? I wanna call 'em.	0
Let's call 'em.	0
Yeah! Ask them if they brought their friends any souvenirs!	1
Hello?  Eighth street deli?	0
Uh sorry, wrong number.	5
Here you go.	0
Hello?   It's the deli again!	2
All right! I'll have a sandwich!	1
I don't think this number's right!	3
Oh come on!!	3
Gotta go. I miss you too, I love you, but it's getting real late now	3
Hey Ma. Listen, I made the appointment with Dr. Bazida, and... Excuse me?  Did you know this isn't Ma?	2
Her name's Ronni. She's a pet mortician.	0
Sure. So how long you been...	0
Remember when you were a little kid, I used to take you to the navy yard and show you the big ships?	0
Since then?!	2
No, it's only been six years.	0
I just wanted to put a nice memory in your head so you'd know that I wasn't always such a terrible guy.	0
...Joe.	0
Y'ever been in love?	0
...I d'know.	0
Then y'haven't. You're burning your tomatoes.	0
Joe, your dad's in love big time. And the worst part of it is, it's with two different women.	0
Of course, course one of 'em's Ma. What's the matter with you.	2
Everything's gonna be all right. Okay, Dick?	0
Hello, I am Guru Saj--Whoa!!  That's supposed to be a duck right? 'Cause otherwise, this is waaay out of my league.	2
Hey, Rach, how was work?	0
Oh, great. Although I did sit down where there wasn't a chair.	0
By the way, Ross dropped by a box of your stuff.	0
Oh, well, I guess I had that one coming.	0
I'm just gonna throw it out, it's probably just a bunch of shampoo and...	0
Something wrong?	0
No. Nothing.	0
And then, and then you said that thing about, about bringing the Mesozoic era in the 21st century.	0
Yeah, that's it?	2
Yeah.	0
Dude, I am sorry about what I said!	3
It's not that bad.	0
Yes it is! From now on, I have no first name.	4
So, you're just Bing?	0
Because we won our apartment back!	1
What? Ace is high! Jack, queen, king, ace!	2
No! Ace is low! Ace, two, three, four!	4
I don't know. Ooh! Ooh! Look it!  Ah-ha!	2
All right, cut, let's pick again, pick again.	0
Okay.	0
Come on apartment! Come on apartment!  Oh! I know queen is high!	4
Uh-huh, not as high as... It worked! King!	2
Yeah baby!	1
But, we pick again! We pick again!	1
Why?!	0
I don't know!	5
Tickets please!  That's courtside baby!	1
Seriously, good game though. Good game.   What are they so mad about? They get the apartment back!	2
No they didn't!	1
You know, I don't think we brought enough stuff. Did you forget to pack the baby's anvil?	0
It's gonna be worth it.	0
It's a known fact that women love babies, all right?	0
Women love guys who love babies.	0
It's that whole sensitive thing.	0
Quick, aim him at that pack o' babes over there.	0
Maybe one of them will break away.	0
No, no wait, for get them, we got one, hard left.	1
All right, gimme the baby.	0
No, I got him.	0
Oh, seriously you want him?	2
Hello.	0
Well, don't, don't think me immodest, but, me?	2
You wanna smell him?	0
Oh, yeah. He's got that great baby smell. Get a whiff of his head.	1
What'd I tell you? What'd I tell you?	1
Well, we are great guys.	0
Bye.	0
Well, not really.	0
I mean technically it's-it's not against the rules or anything, but it is frowned upon.	0
Especially by that professor we ran into last night, Judgey von Holierthanthou.	4
Well Ross, you be careful now. You don't want to get a reputation as y'know Professor McNailshisstudents.	1
Yeah. What-what should I do?	5
Well Ross, it seems pretty clear.	0
I mean what's more important?	0
What people think or how you feel, huh?	0
Ross, you gotta follow your heart.	0
Joey that is so sweet.	1
Hey.	0
Hey-hey-hey! So, how did it go with Dana? Any reason I should leave a block of time open say Thursday?	0
I couldn't do it.	3
You couldn't do it?!	2
Hey, relax I just need more time. We're going to dinner tonight.	0
What?! You're going out with her again!	2
Going out with who?	0
Uh, Dana Keystone from college.	0
Oh yeah! Wasn't she uh	2
No, that was Dana Caplin.	0
Joey! You didn't even know her!	2
Ah whatever!	4
Morning! Hey, how's my favorite genius and my little robot buddy?!	1
Don't touch him!	4
Okay!	2
All right.	0
Umm, all right Wayne, level with me.	0
I-I keep hearing all these rumors that I might get fired.	5
Okay, they even have actors coming in to read for my part!	5
Come on man, you-you got to give me a second chance!	3
I mean, I love-I love this little guy!	1
Ah-ah!!	2
Okay, that's why you didn't want me to touch him right?	2
Here you go!	0
Okay?	0
Stupid!	4
I can't believe it!	2
God!	4
Hey, how you doin'?	0
Hey.	0
Hi. Look um, about what happened earlier...	3
No, hey, well, I-I completely understand. You were, you were stressed.	0
For what? For letting you throw me out of your office?	4
You had no	4
Yeah, well excuse me for wanting to be with my girlfriend on our anniversary, boy what an ass am I.	4
But I told you, I didn't have the time!	4
Yeah, well you never have the time. I mean, I don't feel like I even have a girlfriend anymore, Rachel.	4
Wh, Ross what do you want from me?	4
You want me, you want me to quit my job so you can feel like you have a girlfriend?	4
I know.	0
Ooh, I have to tell you something.	1
What?	0
But I can't tell you.	0
Okay, but wouldn't it be easier if you had to tell me something that you could tell me.	0
Well, sure in a perfect world. But, no, I promised I wouldn't tell, and I swore to like all my gods.	0
Okay. Does it have to do with Ross and Rachel?	0
No.	0
Does it have to do with Joey?	0
No.	0
Does it have to do with-with Chandler and that sock that he keeps by his bed?	0
No, but let's come back to that later!	0
Hi!	1
Richard!	1
Actually, I'm not here to complement the chef.	0
Ohh... Oh, that's okay I hate when people come back to complement the chef.	0
Like I have nothing better to do!	0
So what's up?	0
Well, it was great seeing you the other night.	1
Oh, good to see you too. Did you come down here to tell me that?	0
No! I came here to tell you something else.  I came here  to tell you I still love you.	1
So forcing her to marry Bobby is gonna make that happen?	3
Maybe!  Well! Well...so-so uh, what kind of music does Numb Nuts... Oh forget it! I can't!	4
Joey, I am scared to death about this.	5
But I really think I can do it, I'm just gonna need some help.	5
And Bobby's gonna be here the whole time.	0
You bet I am!  And to answer your earlier question, we're straight-up gangster rap.	1
Look, Rachel's told me how much easier you've made all this on her. Why can't you do that for me?	4
Because! 'Cause... 'Cause you're my baby sister!	3
And you're my big brother!	1
I mean, you're my favorite guy in the whole world.	0
I'm not even scared to tell mom and dad.	0
I was scared of telling you.	5
Well I'd be scared of them, but all right.	5
Joey, I can't stand the thought of having this baby with you mad at me.	3
I want him to have his uncle.	3
Is my baby gonna have his Uncle Joey?	3
Of course he's gonna have his Uncle Joey!	1
We're gonna be all right. I mean, even if we're not married this baby is gonna be so loved. Not just by us.	1
That's right! By his uncle too!	1
And by you.	1
Okay Bobby, why don't we just come over here and let them have a little moment.	0
Come here!	1
No! Seriously! What's wrong with you?!	4
I had a really nice time tonight.	1
So did I. I'm really glad Monica asked us out.	1
I'd love to ask you in, but uh, my sister's visiting and I think she's asleep on the couch.	0
You're sister? You're sister's asleep on the couch?  Ohhh! I saw	2
Oh hey, great, you're up. Rachel, this is my sister Krista. Krista, this is Rachel.	0
Hi!	1
Nice to meet you. I wish you'd told me we were having company, I'd fix myself up!	2
Like it would help.	0
You are so bad!	1
You are!	1
You are!	1
You are!	1
You are!	1
You are!	1
You are!	1
You are so dead! I'm gonna get you.	1
Uh, it was very nice meeting you.	0
Oh my God, it's that Victoria's Secret model. Something... something Goodacre.	2
Hi Mom, it's Jill.	0
She's right, it's Jill. Jill Goodacre. Oh my God. I am trapped in an ATM vestibule with Jill Goodacre!	2
Yeah, I'm fine. I'm just stuck at the bank, in an ATM vestibule.	0
Jill says vestibule... I'm going with vestibule.	0
I'm fine. No, I'm not alone... I don't know, some guy.	0
Oh! Some guy. Some guy. 'Hey Jill, I saw you with some guy last night. Yes, he was	1
Are you seeing anybody right now?	0
Og-ee-op, I'm not asking for me, I'm... I mean... No, I'm-I'm not gay, I'm not asking you out.	5
I'm not-I'm not-I'm not gay!	5
Personal shopping? What is that? Like where you walk around with snooty rich people and tell them what to buy?	0
Uh-huh.	0
That sounds great!	2
Hey!	0
Umm, excuse me, we switched apartments. You can't eat are food anymore, that-that gravy train had ended.	4
There's gravy?	2
If you have the big apartment you have to deal with people coming over all the time.	0
That fridge has got to be stocked, okay, that's your department now.	0
What are you doing?	0
I think I left a donut up here.	0
So, in conclusion, the lines all go up , so I'm happy.	0
Great job team!	1
Tomorrow at 8:30.	0
Phil!	1
