I've been a nice guy up until now, but uh, I don't need this grief.	4
I'm gonna call the landlord and tell him that Monica is illegally subletting here grandmother's apartment.	4
Your friends are outta here pal.	4
Why don't you tell me something I don't know!	4
All right! I found one that fits!	1
Well y'know what they say, the 23	0
Whose is it?	0
Oh does it matter?! All that matters is that you look so handsome.	3
No! Don't say that! Don't say that!	5
Damn it!	1
No don't! Go back to repeating!	5
Damn it!	1
Oh crap!	4
Oh crap!	1
Hey Rach! Hey, you mind if I read my comic books in here?	0
Sure! Why?	2
Oh well, Chandler and Monica are over there and it's kinda hard to concentrate.	0
What?!	2
She just called and said that she was gonna be working late!	4
She keeps lying to me!	4
That's it!	4
I'm just gonna go over there and confront them right now!	4
So Chandler, I-I'd love to come by tonight.	1
Really?	2
Oh absolutely. Shall we say, around seven?	1
Yes.	0
Good. I'm really looking forward to you and me having sexual intercourse.	1
Hey-hey, check it out! Check it out! Ugly Naked Guy has a naked friend!	2
Oh yeah!  Oh my God! That is	2
Yeah, it is! Naked Ross!!	2
Y'know, hey! You're the one who ended it, remember?	4
Yeah, because I was	0
You still love me?	4
What does this mean? What do you, I mean do you wanna, get back together?	0
Noo! Maybe! I, I don't know.	3
What?!	2
I just, I feel, I-I just...	3
I won! I won! I finally won!	2
I won! That was my quarter!	4
Fine! Here! Take a hike toots!	4
Excuse me, sir! This lady played my quarter, this is my money.	4
Is that true miss?	0
What?!	2
It was my quarter!	4
Was it her quarter?	0
How about we talk about this over dinner?	0
No! No, you can't arrest me! No!! I won't go back! I won't go back to that hell hole!!	4
I'm just taking you outside!	4
Oh, okay.	0
Hey!	0
Hey!	0
Listen, I know you wanted to talk to me, but I have an idea that may make you want to stay married.  We register, and	0
No!	4
Ross, come on!	4
No!	4
Listen, look I thought a lot about how to tell you this and the bottom line, Ross, is we can not stay married.	3
I don't know if it's true.	0
Oh b-b-but it is!	4
Oh, okay, y'know what this is?	0
Oh Ross, come on! This is not, this is not a marriage!! This is the world's worst hangover! Ross, listen, if	4
All right. All right, I'll do it.	3
Thank you.  Hey-hey umm, uh, is there, is there any such thing as an annulment shower?	0
Hey! What are you guys doing?	0
Making holiday candy for the neighbors.	0
Yes!	1
So I really never get to win anymore?	3
How much did ever really win before?	0
He is so cute.  So, where did you guys grow up?	0
Brooklyn Heights.	0
Cleveland.	0
How, how did that happen?	2
Oh my god.	2
What?	2
I suddenly had the feeling that I was falling. But I'm not.	0
Ok, I'm makin' a break for it, I'm goin' out the window.	0
No, no, no, don't! I've been waitin' for like, forever to go out with Lorraine. Just calm down.	4
Calm down? Calm down? You set me up with the woman that I've dumped twice in the last five months!	4
Can you stop yellin'? You're makin' me nervous, and I can't go when I'm nervous.	4
I'm sorry, I'm sorry, you're right.  Come on, do it, do it, go, come on!!!	4
Hey you guys, guess what?	0
The British are coming?	0
Ohh, you and your ways.  Since it's Christmastime. I'm going to be one of those people collection donations.	1
Yeah, I already have my bell and later on...I get my bucket.	1
Ohh.	0
Yeah, yeah, I'm going to be out there spreading joy to the people.	1
I mean, last year, I spread a little joy but not really enough.	1
So this year, I'm going to do the whole city.	1
You know, I knew a girl in high school who did that. She was	0
I can't	0
Oh! Look at that, time's up! My turn!	1
That was a half an hour?	2
It's your timer.	0
Y'know, I don't like to brag about it, but I give the	0
All right, then massage me up right nice!	1
Ah! Ahh!! Ahh!!	1
It's so good, isn't it?	0
It's so good I don't know what I've done to deserve it!	1
Say good-bye to sore muscles!	1
Good-bye muscles!!	1
Oh whoa-whoa-whoa!	4
Wait a minute, open up your hand; let me take a look.	0
Quarter.	0
Dime.	0
Lint?	0
Not interested in that.	0
What's this?	0
A Canadian coin?	0
Get outta here!	2
Whoa-whoa-whoa!	2
No drinks near the bucket!	4
Set it down over there and then you can make a contribution!	4
And you can leave the hurt bunny look over there too!	4
Hi Bob!	1
I thought I told you to get outta here!	4
Uh, Phoebe we've been getting complaints and uh, we're gonna move you to a less high-profile spot.	0
"Well, because we thought you knew!! It's so obvious! God, that would be like telling Monica, ""Hey, you like things clean."""	0
Hey Joe! You wanna shoot some hoops?	1
Oh no, I can't go. I'm practicing; I got an audition to be the host of a new game show.	1
Oh cool!	1
That's great.	1
Yeah-yeah, and if I get it by day I'll  Dr. Drake Remoray, but by night I'll be  Joey Trrrribbiani!	1
You'll be perfect for this! That's already your name!	1
But the audition's in a couple hours and I don't even understand the game.	5
Well do you want some help?	0
Oh really? That'd be great! You guys can be the contestants!	2
Awesome!	1
Okay, I guess we can lose to junior high girls some other time.	0
All right! Let's play Bamboozled!	1
Bamboozled?	2
Yeah, isn't that a cool name?	1
Yeah!	1
Oh. Okay, just breathe.	0
Oh honey, I think I'm having one too!	2
Look at this!  There we go!	1
Excuse me. Hi, I'm a professor here. Do you know the Paleontology section, fifth floor, stack 437?	0
Well, yes! Just give me five minutes, I just have to find someone to cover my shift.	1
No! No!! No! Can I speak to someone in charge please?!	4
How can I help you?	0
Hi, I was wondering if it is possible to increase security in the Paleontology section?	4
See I-I wrote a book up there and instead of reading it people are-are-are well, rolling around in front of it.	4
We are aware of the problem you are referring to.	0
But as far as increasing security, I'm afraid the library is very understaffed.	0
I, I can't help you.	3
Well, fine.	4
Fine!	4
If-if I'm the only person with any appreciation of the sanctity of the written word, I'll go up there and defend it myself!	4
And don't you follow me!	4
Okay. Would you rather live in the shirt pocket of a sweaty giant, or inside his shower drain?	0
Oh my God! Phoebe look, it's Ross and that girl.	2
No! No! Look at that!  It's a line of ants! They're working as a team!	2
Right, oh yeah.	0
Wow, oh, it looks like Ross is breaking up with her.	2
Uff, I hope he lets her down easy.	0
Come on Phoebe, look at that!	4
They are not breaking up, look at them.	0
Okay that's, you know what that is?	0
That is a, that is a second date, that's what that is!	3
Look at that, she just put her hand on his thigh...	0
Oh no! That really is nothing, she is	0
Ohh!  Phoebe, this is all your fault! Now he loves her, he's gonna marry her, and this is all your fault.	4
You know where I work!	0
I do?	0
The movie theatre, you used to come in all the time.	0
You still work at the multiplex?	0
Oh, like I'd give up that job! Free popcorn and candy, anytime I want. I can get you free posters for your room.	1
Thanks, I'm set. Do you still live with your parents?	0
Oh yeah, but I can stay out as late as I want.	0
Nice car!	1
Yeah, it's not mine.	0
I love your car.	1
Yeah, it's  mine.	0
I bet it's fast.	0
Me too! Yeah. And comfortable. Do uh, do you like leather seats?	0
Yeah!	1
It's got 'em!	1
Joey, please!	5
Sorry.	0
Ahhh..	4
Hello children!	1
Hey! Wanna play some foosball? Please?	0
Okay.	0
No-no, no! We have to move the table into my room, yeah! 'Cause of all the boxes. Come on!	0
All right, I have one question.	0
Bye-bye little puppet Joey hand?	0
No, the quiet down thing!	4
You mean this.	0
Um-hmm! Look, I-I-I don't know how much more of this I can take! Did you know he taped over my	4
All right look, y'know, this maybe tough but come on, this is Ross! I survived college with him!	0
All right, I guess I can hold out a little longer. Let's have a game.	0
Okay.	0
No-no-no-no!	5
YES!!	1
Uh fellas,	0
Okay, so he's out of here.	0
Okay y'know what, because you said that, I'm not putting out tonight.	0
I know it doesn't make much sense	0
Much	0
Look Chandler, it was instinct! Okay? I just went for it!	4
So you risked your life, for a sandwich!	1
I know it sounds crazy, but Chandler this is  the greatest sandwich in the world!	1
So you didn't uh, choose Ross before me.	3
No! I would never do that! You-you're like my brother!	3
Really?!	2
Yeah! In fact, to prove how much you mean to me,  here.	0
Thanks.	1
No, eh, oh-oi, easy, it's not a hot dog!	4
How good is that?	0
Oh-oi-ho, yeah!	1
See?	0
Oh-whoa-hey, dude, what are you doing?!	2
I thought you were showing me how much you mean to me.	2
Yeah. With a bite!  Gee-e-e-eez!	1
Check out the ring.	1
Nice! One and a half carat easy.	1
Hi.	0
Hey-hey Pheebs!	1
Chandler's gonna ask Monica to marry him!	1
Oh I know, I helped pick out the ring.	0
You told her before you told us?	2
Well, she walked in when I was looking at the ring brochures. You can understand that, right?  Guys? Guys?	5
Let's see.	0
Congress is debating a new deficit reduction bill... the mayor wants to raise subway fares again... the high today was forty-five... and- oh, teams played sports.	0
What about Glen? He could be a Glen.	0
Nah... not-not special enough.	0
Ooh! How about Agamemnon?	0
Waaay too special.	0
Hey Pheebs!	1
Hey!	1
Check it out.  How much of a man am I?!	1
Wow! Nice! Manly and also kind of a slut.	1
Y'know, I'm beginning to see what Jake was talking about.	0
Uh-huh.	0
The silk? Feels really good!	1
Ah yeah, sorry about that.	3
It's okay. Come, come on in.	0
Thanks for letting me stay here! I mean Monica's place was nice, but her fiancee sure stares a lot.	1
Oh.	0
Oh my God! You do a great Chandler!	2
Uh-huh. Yeah, I-I have a knack for impressions.	0
Well, maybe after we get reacquainted uh, you can do me.	1
Hey! You guys! Check it out, check it out!  Guess which job I got.	1
I don't know, but Donald Trump wants his blue blazer black.	0
What?	0
Blue blazer back. He-he wants it back.	0
But you-you said black. Why would he want his blue blazer black?	0
Well, you-you know what I meant.	0
No, you messed it up. You're stupid.	4
So what job did you get Joe?	0
Oh, ah, tour guide at the museum. Yeah, Ross got it for me.	0
Well, how can you be a tour guide, don't you have to be a dinosaur expert or something?	0
I just walked in the bathroom and saw Kathy naked! It was like torture!	4
Y'know if we ever go to war and you're captured, you're in for a	0
It just keeps getting worse and worse!	4
I mean it's bad enough that I'm in love with my roommates girlfriend... which by the way, I think she knows.	0
Because every time we're in the room together there's this weird like energy between us.	0
And call me crazy, but I think she likes me too.	0
And now I have seen her naked.	0
I mean at least when I've seen her with clothes on, I could imagine her body was like covered in boles or something.	0
But there are no boles, she's smooth!	0
Smooth!	0
Wow! Could everyone totally see up his robe?	2
Yeah! Oh my God!	2
So, you and Angela, huh?	2
Yep. Pretty much.	1
Oh, that's what she meant!	2
You know, if they're    gonna shorten it, they should call it the MUSE!	0
You know, short for museum,    and avoid all the confusion!	0
Yeah, most of it it's a place	0
Ok, all right, so I'll take her to the MET.	0
Yeah, uh, uh, ok, there's this great rare bookstore on Madison    Avenue.	0
You know what?	0
She loves architecture, you know what you should do?	0
You should take a walk down fifth to the Saint Patrick's Cathedral and there    there's this great little pastry shop that she'd love.	1
Geez, sounds like you should be going on this date!	2
But I'm not! . You know what if you're in the mood for    Thai food...	0
Whoa, whoa, whoa! Slow down, you go	2
Ok.	0
You got to tell me exactly what to do there.	0
Ok, when you walk in the museum, take the right, that's the antiquities    wing.	0
Ancient Egypt, Mesopotamia, up to the Byzantine Empire.	0
Whoa, whoa, whoa, whoa, whoa! So, I walk in the door and make    the right	2
Hey!	1
Hey, so did everything go all right with the annulment?	0
Oh, yeah, no problems. It's all taken care of.	0
Ross, thank you. Hey, do you guys wanna go see a movie?	0
Oh yeah, why not?	0
Pheebs?	0
No thanks, I've already seen one.	0
Okay, umm, I'm gonna get my sweater.	0
Okay.  You uh, you wanna hear something weird?	1
Always.	0
I didn't get the annulment.	3
What?!	2
We're still married! Don't tell Rachel. See you later.	1
Hey! Are you okay?	0
Fabulous.	1
Listen, drama critics they're nothing but, but people who couldn't make it as actors. You know what you should do?	1
Exactly. So you didn't, didn't mention anything to Issac right?	5
Oh, well I tell Issac everything.	0
You tell, of course you do. Issac. Issac. Hey, Issac. Issac, hi! Y'know we haven't actually met...	0
You dog!	1
Yes, I suppose I am a dog. But Issac, see I-I happen to have a girlfriend.	0
Oh right, that Rachel chick from the coffee place.	0
Yeah, that's the one. Listen, I don't want to hurt her.	0
Oh, hey, man I know, doesn't matter how much we love 'em, monogamy is too cruel a rule.	0
Yeah. Listen, can you keep this information to yourself?	0
Aw, no problem dude. Y'know we got to look out for each other. We're the same, you and me.	0
Actually, no, we're not.	1
Yeah, we are.	0
No, we're not.	0
Yeah, we are.	0
No, we're not!!	4
Okay, we're not.	0
Right.	0
But, we are.	0
Fine. I just need to know that you're not gonna tell your sister.	0
I can promise not to tell her again.	0
Emily!	1
Oh my God! What are you doing here?	2
I just, I had to see you one more time before you took-off.	1
You are so sweet.	1
That's, that's, that's a big candy bar. (She's holding one of those huge	3
Me too.	0
Well, that' me.  Here, have this.  I'm only allowed one piece of carryon anyway.	0
Wait uh, listen.	0
I-I, I have to tell you something.	5
Umm, I've been thinking, I'm just gonna come out and say it.	5
Okay?	5
I-I-I ah, I-I think I love you.	1
Oh.  Thank you.	0
That's no problem.	0
Monica!	2
She's sleeping.	0
I know, just quick-quick question, quick question. Which one was	0
Deep Impact	0
Sorry, I just...can't sleep.	2
Ooh!	4
Where is that book that you are reading with the two women who were ice-skating and wearing, wearing those hats with the flowers on it?	0
Because every time I look at that cover I'm like	0
It is in the living room where there is also a light! And no one will kick you in the shin.	0
Hey Ross! So, I was checking out the uh, real estate section	3
Yeah?	0
Look at this.	0
Oh, it looks like mom and dad's house.	0
Oh, it even has a tree with a broken limb out front and the uh, the window in the attic is...Oh my God!	2
What? What happened to the window in the attic?!	2
I can't believe mom and dad are selling the house!	4
I can't believe they-they didn't even tell us!	1
I can't believe I still don't know what happened to the	2
Nothing?	0
Look, you and I have been given a gift.	0
We have to do something with it.	0
Like-like, hand modeling!	1
Or-or magic!	1
I have to get back to	0
Whoa!	2
Whoa!	2
We could have our own show!	1
Y'know we could clap our hands together people will love it!	1
Huh?	4
And-and-and I wrote a song for us!	1
(Singing, to the tune of	1
That's okay.	0
But you haven't even heard the chorus!	0
Well, she'll understand right? It's not like I did it on purpose.	3
Dad, that won't matter to her.	0
Look, all my stuff is safe and dry and all hers is-is, is growing new stuff!	4
See, this is exactly the kind of thing that makes her think you guys love me more than you love her.	4
Oh my God, does she really thinks that?	2
Well, can you blame her?	3
Well I don't know, I-I suppose we may have favored you unconsciously, you were a medical marvel! The doctor said your mother could	1
Dad, dad I don't want to hear about it.	3
Really?	2
Well, not right now.	0
Okay look, Monica came here for some memories and damnit, we're gonna give her some!	0
Okay, grab...grab some empty boxes.	0
Okay?	0
We'll-we'll take stuff from mine and whatever we can pass off as hers we'll-we'll put 'em in there.	1
Y'know Joey, I could teach you to sail if you want.	1
You could?	2
Yeah! I've been sailing my whole life. When I was fifteen my dad bought me my own boat.	1
Your own boat?	2
What?! What?! He was trying to cheer me up! My pony was sick.	2
He's coming here for Thanksgiving!	1
Count in our heads as-as good	4
I guess I'm done.	0
Fun's over	1
Wait-wait, guys! If-if we follow the rules, it's still fun and it means something!	5
I think I'm gonna take-off.	0
Guys, rules are good! Rules help control the fun!  Ohhh!	1
Dehydrated Japanese noodles under fluorescent lights... does it	0
Question. You're not dating anybody, are you, because I met somebody who would be perfect for you.	0
Ah, y'see, perfect might be a problem. Had you said 'co-dependent', or 'self-destructive'...	0
Do you want a date Saturday?	0
Yes please.	0
Okay. He's cute, he's funny, he's-	0
He's a he?	2
Well yeah!	2
...Oh God.	5
I- just- I thought- Good, Shelley.	4
Well, it's official there are no good movies.	3
Well, let's go to a bad one and make out.	0
Perhaps, you would like me to turn like this,  so that you can bunny bump against my back.	0
Hey!	2
Hey.	0
Hey, man. What's up?	0
Maybe you can tell me.	0
My agent would like to know why I didn't show up at the audition I didn't know I had today.	4
The first good thing she gets me in weeks.	0
How could you not give me the message?	4
Well, I'll tell ya I do enjoy guilt, but, ah, it wasn't me.	4
Yes, it was! It was him! Uh huh!  Okay, it was me!	4
See Joe, that's why your parents told you not to jump on the bed.	0
Can I ask you something? Have you ever had a guy have a crush on you?	0
Is that why you wanted to tie my tie?	2
There's this kid in my class who said he's in love with me.	3
Whoa!	2
Whoa what?	2
Ross has a boyfriend.	0
I do-I do	1
Really?	2
Yeah!	1
I don't know.	0
I mean, last year Elizabeth now-now this kid.	4
What-what-what-what is it?!	1
Am I giving out some kind of...sexy professor vibe?	4
Not right now.	0
It-it... The point is my natural charisma has made him fail his midterm.	3
Oh, see now I feel bad for the kid!	3
I had a crush on a teacher once and it was so hard!	1
Y'know you... I couldn't concentrate and I blushed every time he looked at me.	0
I mean come on, you remember what's it's like to be 19 and in love.	0
Oh yes! Thank you very much!  Oh that's-that's actually how the French drink it.	1
A new pair of shoes for the Chan-Chan man!  Yes!	1
Yes! I've-I've never seen a roll like this in my life!	1
That's right baby! Okay, what do I want now?	1
Okay, ah umm, ah, a 8. Ah, a 6?	0
Pick a number! That is your	0
8. 8!	1
Thank you!	1
If you get this one, we buy everybody here a steak dinner!	1
Yeah, I understand.	0
Take as much time as you want.	0
Ten, even twenty minutes if you need it.	0
I'll be here.	3
Not smoking.	3
We're really gonna do this, huh?	2
Looks like it.	0
Y'know, if, if this is too weird for you, we can still back out at	0
I got it!	1
Okay.	0
Susan! Hi!	1
Hey!	1
Thank you so much for coming.	1
Oh, I wouldn't miss it for the world.	1
I'm-I'm Ross by the way.	0
Hello Ross.  I love what you've done with this space.	1
Thank you so much.	1
How hot is this?!	2
Guess who's here. It's the toughest guy in toy land, Ben.  'A real American hero. I'm	0
G.I. Joe	0
Look Ben, it's a toy that protects U.S. oil interests overseas!	1
It took me 28 years to find one man that I wanna spend my life with, if I have to wait another 28 years then, I'll be 56 before I can have a baby, and that's just stupid.	3
I don't need an actual man, just a couple of his best swimmers.	0
And there, there are places you can go to get that stuff.	0
Down at the docks again?	4
Hi there. How many, how many ah, did you sell?	0
I'm not gonna tell you! You're the bad man who broke Sarah's leg.	4
Hey now! That was an accident, okay.	4
You're a big scrud.	4
What's a scrud?	0
Why don't you look in the mirror, scrud.	4
I don't have too. I can just look at you.	1
All right girls, and man. Let's see your final tallies.  Ohhhh, Debbie,  321 boxes of cookies,  Very nice.	1
Not nice enough.	4
Charla, 278. Sorry, dear, but still good.	0
So, how'd the lasagne go over?	0
Really?!	2
Good.	0
So you owe me three pretty things.	0
Yeah, I've been thinking a lot about you too.	0
It's hard this whole platonic thing.	3
It's a word!	2
Yeah, I do think it's better this way.  Yeah, we're being smart.   Yes, I'm sure.	0
You really sure?	0
I'll call you back.	0
So, are you really gonna go out with that nurse man?	2
Well uh, you and I are just goofing around, I thought, why not goof around with him.	0
Y'know, I don't know if you've ever looked up the term goofing around in the dictionary... Well, I have, and the technical definition is, two friends who care a lot about each other and have amazing sex and just wanna spend more time together.	0
But if you have this new fangled dictionary that gets you made at me, then we have to, y'know, get you my original dictionary.	0
I am	0
I think you're better than you think you are.	0
Really? Okay, so	2
Know when to stop.	0
Y'know, I sensed that I should stop. So we're okay?	0
Yeah. All right, I'm gonna go tell Dan that it's not gonna happen.  Don't do the dance.	0
Right!	1
Ow!-Ow!-Ow! Ow! Ow! Ow! Ow! Ow! Ow! Y'know, ow!	4
Hey!-Hey! What's going on?	2
She broke my arm.	4
He touched my fanny.	4
No, she touched mine first!	4
That's my job!	4
Are you being British?!	2
No. Not anymore.	0
Why are you shopping here? You don't live in this neighborhood. Were you here waiting for me?	2
Yeah, huh. I'm just uh, you know I'm just picking up some things for a party.	0
Barley? What kind of party serves barley?	4
Well, I'm sorry if my friends aren't as sophisticated as yours.	4
Where is this party?	0
Here in Chelsea.	0
Who's party is it?	4
A woman's	0
What woman?!	4
Chelsea.	0
So like which of these two guys do you want to be?	3
Can I be that guy?	1
Great story again! The yarns that you weave! Woo-hoo-hoo!	1
Y'know uh, actually I-I-I should get going.	4
Oh no-no-no! Stay! Stay! Because you-you should you-you-you should stay!	5
Wow. Oh, I am really flattered, but I just I don't feel that way about you.	2
Oh no-no-no, that's not... No-no-no!	4
Did you just flick me?	4
OK, well, you wouldn't let me finish and I was jus- [Monica flicks her back] Ow. That hurt [flicks Monica]	1
Oh! All right. Now, let's not do this!	4
Happy thoughts! Happy thoughts!	4
OK, now I'm gonna kick some ass.	4
Ow! Ow! Ow!	4
Alright, now I will let go if you both stop.	0
Fine!	4
Fine!	4
There we go.You know what, if we were in prison, you guys would be, like, my bitches.	0
Okay, buddy-boy. Here it is. You hide my clothes, I'm wearing everything you own.	0
Oh my God!	2
Look at me! I'm Chandler! Could I	1
Whew, it's hot with all of this stuff on.	0
I ah, I better not do any, I don't know, lunges.	0
Hi.	0
Hi.	0
Hi, listen, I'm sorry about before.	3
I don't need to have a game room.	0
I mean when I was a kid I only played those games because I couldn't get girls, and now I	0
Stop it Chandler.  I'm sorry too.	3
Really?	2
Yeah! Oh yes!	4
Ohh.	0
Listen, we don't have to make that a guest room, we can think of something to do with the room together.	1
That's a great idea! We can	1
Totally!	1
We don't have to come up with this now.	0
Oh good.	1
Yeah, and I am okay with being a pushover.	0
That's great. Good for you guys.	1
I am not high maintenance!	4
I am not a pushover!	4
Who said you were?	0
You did!	4
Oh, I'm flaky. I'll say anything.	0
Ok, I know this is gonna sound really stupid, but I feel that if I can do this, you know, if I can actually do my own laundry, there isn't anything I can't do.	1
That does not sound stupid to me.	0
You know, it's like the first time I had to make dinner for myself, after Carol left me?	0
I'm sorry, that's all the time we have.	3
Next on Ross... Uh-oh.	0
What uh-oh?	1
Uh-oh, uh-oh, the laundry's done.	5
It's, uh, it's a song.	0
The laundry song that we sing.	0
Uh-oh the laundry's done, uh-oh, uh-oh.	0
Ross, what's the matter?	4
Nothing, nothing. Lee-lo, the laundry's done.	0
Why are you here?	2
Well, Sid and I are trying again and we had trouble last time    because apparently we...	3
No no no... I mean,	0
Oh! Someone's a little cranky today cuz they have to do it in    a cup!  Oh! They gave you the kiddy size .	4
What!?	2
This was fun! But I've got an invasive vaginal exam to get to!	1
I'd love to stay, but I have eh...  got    a hot date...	1
Please... go!  Just let me know if you    need a hand!	0
I think it just fell off.	0
I don't want to be single, okay? I just... I just- I just wanna be married again!	3
And I just want a million dollars!	5
Rachel?!	2
Yeah.	0
Look, these clowns are trying to take us for a ride and I'm not gonna let 'em!	4
And we're not a couple of suckers!	4
I hear ya, Mugsy!	0
But look, all these rooms are fine okay?	0
Can you just pick one so I can watch--have a perfect, magical weekend together with you.	4
Okay,	0
Nothing! It's over! Dammit! This is regularly scheduled programming!	4
Oh, I'm sorry, am I getting in the way of all the room switching fun?	4
Hey, don't blame me for wigging tonight!	4
Oh, who should I blame? The nice bell man who had to drag out luggage to 10 different rooms?	4
