Look at her, she's even got waitress experience.	3
Last night she was teaching everybody how to make napkin....  swans.	3
That word was swans.	0
What do we got there?	2
A piece of something: boxer shorts, greeting cards, and what looks like a half-charred picture... Wow, that guy's hairier than the Chief!	2
You know, it's a really funny story how this happened.	1
It's all right.	0
It's all right.	0
You don't have to explain.	0
This isn't the first boyfriend bonfire that we've seen get out of control.	0
You're our third call tonight.	0
Really?	2
Oh, sure, Valentine's is our busiest night of the year.	0
I'm so sorry, you guys. I didn't mean to bring you down.	3
No, you were right. I don't have a plan.	0
Thank God. Food.	1
Phoebe?	0
What?	0
Do you have a plan?	0
I don't even have a 'pl'.	1
No, no, that's not what we ordered... We ordered a fat-free crust with extra cheese.	3
Wait! Did you say 'G.Stephanopoulos?'	2
Wait, was this a-a small mediterranean guy with curiously intelligent good looks?	2
Was he wearing a stunning blue suit?	1
And-and a power tie?	1
Oh God.	2
Are you nuts?! We've got George Stephanopoulos' pizza!	2
Uh, Pheebs? Who's George Snuffalopagus?	0
Big Bird's friend.	0
I see pizza!	1
Oh, I wanna see! Lemme see! Lemme see!	1
Hello? Who are we spying on?	3
Hey, y'know what a really good rainy day game is?	0
What?!	0
I mean naked game. Strip poker, we should totally play strip poker.	1
Come on! When you go away, you-you have to play, it's like a law!	3
Allll done!	0
Aww, thank you.	1
Okay, who's next?!	0
Come on, please?! I'm boredddd! You let me do it once before.	0
Yeah well, if ah, if that's the rule this weekend...  No!	1
It's beautiful! It's like the first bathroom floor there ever was.  Whoa! Are you going in there for?	2
What, like a number?	0
Hey!	1
Hi! Bye!	0
Okay, I'm done with my choices, these are final.	0
Well, it's about time.	4
Ooh, very official.	0
Oh, yeah, well y'know Chandler printed it up on his computer.	0
And who laminated it?	0
That would be me.	0
All right let me see.  Uma Thurman, Winona Ryder, Elizabeth Hurely, Michelle Pfieffer, and Dorothy Hammel?	0
Hey, it's my list.	4
Okay honey, you do realize she only spins like that on ice.	0
Okay, Phoebe, this Dr. Oberman. He has no strong feelings about Fonzie or any of the	0
Hi! And you're going into what grade?	2
Umm, I'm actually a first year resident, but I get that a lot, you see, I-I graduated early	1
Uh-huh, me too. Ross, maybe I should've specified that I'd be needing a grown up doctor.	1
Oh no, I'm fully qualified to	1
Shh!	4
Doogie, shh!	4
Doesn't anybody understand that I'm gonna be having babies soon?	2
Huh?	2
Go!	4
Go little boy, go!	4
Oh cool! You made him cry!	1
Hey, there's uh, some people outside, askin' about candy.	0
Well, they're just gonna have to wait aren't they? I've only got two hands!!	4
Need some help?	0
No! You don't know the system! There'll be nobody messing with the system!	4
Your license please.	0
You don't-you don't want to hear about my dream Officer...Pretty?	0
It's Petty.  I'll be right back with your ticket.	0
You have a son!	2
I know. I know.	0
Uh, like, could these margaritas	0
Hello, Mr. Bing.	0
Loved your Stevie Wonder last night.	1
Thanks. Listen, about the weekly numbers, I'm gonna need them on my desk	0
Sure.	0
No problem.	0
You have to give 'em something, you know.	1
Okay, now that was Gerston, Santos, and who's the guy with the moustache?	0
Petrie.	0
Petrie, right, right. Okay, some people gonna be working	0
....right?	4
Right?	4
I mean it's pretty unbelievable y'know, I mean they just took off, took off without even looking back.	4
Y'know I don't, I don't need them, huh, I've got you guys now as friends, you and Susan.	4
Ah, Susan will be so pleased.	1
717?  Where's 717?  Hey, you've have more of these for Susan right?	2
No. But it's okay, I'll just put out pickles or something.	0
Ross, thank God.	1
Pheebs? What, why are you whispering?	2
Hey Rach, the tampons here are only a penny. Let's stock up.	1
Listen Ross, we ran out of gas, and we don't know where we are, so we can't get a tow truck.	5
Oh, now you want a favour?	1
Yes, please.	0
Well, oh, I'm sorry your car broke down Pheebs, but I'm a little too busy with some of my real friends right now, but please call to let me know you got home safely okay?	4
Phoebe, hang on a second.  Here, take my car, go pick up your friends.	0
No, I'm not gonna pick them up.	4
Listen, we both know you're gonna do it 'cause you're not a jerk.	0
So you can either sulk here for a half hour and then go pick them up, or save us both time and sulk in the car.	4
No, Rachel doesn't want me to....	4
Look, I-I-I am sorry that Rachel dumped you 'cause she fell in love with that Mark guy, and you are the innocent victim in all of this, but don't punish your friends for what Rachel did to you.	0
Yeah, you're right.	0
God, I feel so guilty about Ross.	3
Oh, I know.	3
I kinda feel like it's my fault.	3
Kind of? If you just kept this to yourself none of this would've happened.	4
Well, I'm keeping so many things to myself these days, something was bound to slip out!	4
Well, I think it's very brave what you said.	4
All right, I can't sit here anymore. I have to walk places.	0
Pheebs, what are you doing with the coat? How about the whole animal rights thing?	4
Well, I've been reading up and for your information, minks are not very nice.	4
Okay, I admit it!	4
I love this coat!	1
Okay, I... it's the best thing I've ever had wrapped around me, including Phil Huntley!	1
Remember Phil Huntley?	0
He was fine!	1
So your dad dropped by. He's a pleasant man!	1
Oh no	5
I'd better go. (She goes and sits down in the	0
Ross I'm so sorry. Okay. I-I will promise I will straighten this out with him tomorrow in person, or via e-mail.	3
I don't care about your dad! I care about Mona! She was there and now she's totally freaked out!	4
Oh okay, I'll fix that to. What's her e-mail address?	0
Rachel!	4
All right, I promise. I'll fix this. I swear. I'll-I'll-I'll-I'll talk to her.	5
Okay!	4
Okay.	0
Thank you!	4
That's it?!	4
You call that a fight?	2
Come on!	4
"""We were on a break!"""	4
"""No we weren't!"""	4
What happened to you two?	2
Hi, could we get two burritos to go, please?	0
I'm sorry.	0
But not that sorry, 'cause you don't have to live with it.	0
Um, we have a reservation under the name Chandler Bing.	0
Oh-kay, we'll have a table for you in about 45 minutes.	0
Forty-five minutes? We have tickets to the	2
I'm sorry. Christmas is a very busy time, sir.	0
Is this because of the burrito thing?	3
You need to give him money.	0
Give him money? It was a joke!	2
No, to get a table! Places like this are always shakin' you down. Everybody wants to be paid off.	4
Right, calm down, O'Mally. I'll slip him some money.	0
You've got to be smooth about it.	0
Hey, I can be smooth.	0
Listen, we're a little bit in a hurry, so, if you can get us a table a little quicker, I'd appreciate it.	0
Of course, sir.	0
Okay.	0
I'd better get back to my desk.	0
Okay, you hard worker! I'll remember to put that in your evaluation.	1
My what?	2
Well, you've been here for two months now and your boss is required to hand in a performance evaluation.	0
But y'know, there is one thing that I have yet to evaluate.	0
Are you serious?	2
No, I've just always wanted to do that. Can you help me clean this up?	0
I can blow dry it.	0
I can put gel on it.	0
It doesn't matter, I still wind up with this little  cowlicky thing on the middle part of my head.	0
Does it bug you?	3
Is there any chance you didn't see that?	0
Hey Joey, what 'cha doing?	0
Sweepin'. Why? Turn you on?	0
No.	0
Huh. What if I was sweeping a chimney?	1
Joey, did	0
Where are you going? The vicar won't be home for hours.	1
Joey,  where did you learn that word?	2
Where do you think,  Zelda?	0
You found my book?!	4
Yeah I did!	1
Joey, what-what are you doing going into my bedroom?!	4
Okay, look I'm sorry, I went in there to take a nap and I know I shouldn't have, but you got porn!	2
Hey-hey, y'know what?	4
There's nothing wrong with a woman enjoying a little...erotica.	0
It's just a healthy expression of female sexuality, which by the way, you will never understand.	4
You got porn!	1
Well, I feel like a snack!	1
Do you want some shortbread? Eh that's Scottish like you are.	0
Oh no thanks. I don't like	0
What?!	2
Well it's just my entire family was run out of Scotland by...Vikings. Anyway, lots of bad memories.	3
Oh well, it sounds to me like your family is ready to uh, rediscover its Scottish roots.	0
You can not play bagpipes at the wedding!!	4
How did you know about that?!	2
Hi!	1
Hi!	1
Come in.	0
Thanks for comin' back, umm, okay there have been a lot of people interested in the room, but I have narrowed it down and	0
Great!	1
Okay now, before I make my final decision I uh, I just want to make sure our personalities match.	0
Okay, so I made up a little test.	0
Now, I'm gonna say a word and then you say the first thing that comes to mind.	0
I can do that.	0
Okay! Here we go. Pillow.	0
Fight.	0
Very good! Okay. G.	1
String?	0
Excellent! Okay umm, doggy.	1
Kitten?	0
Ooh, sorry! No-no-no, so close though, but... bye-bye!	3
Monica, leave him alone	4
Will you hurry up?	3
Did you not hear me before when I told you that all of Janine's friends are dancers?!	2
And that they're going to be drinking alot!	4
No, I did, but tell me again, because it's so romantic.	0
Well you're whippin' so slow! Can't you do it any faster?	4
Joey!	4
Come on!	4
I don't wanna make any mistakes, alright?	4
This is the only dessert and if I screw it up everybody's gonna be like 'Oh, remember that Thanksgiving when Rachel screwed up the trifle?'	5
So why don't you just let me worry about making the trifle and you just worry about eating it, alright?	0
Oh I am!	1
Ross, if you don't tell them, then I will!	4
Okay, fine!	4
Ross! Can I talk to you for a second?	0
Oh, uh, can it wait a second Joey? I have to tell my parents something. No it can't? Okay.	0
You are so cute! How did you get to be so cute?	1
Well, my Grandfather was Swedish and my Grandmother was actually a tiny little bunny.	1
Okay, now you're even cuter!!	1
Y'know that is a popular opinion today I must say.	0
What?	2
The weirdest thing happened at the coffee house, I think, I think Phoebe was hitting on me.	2
What are you talking about?	2
I'm telling you I think Phoebe thinks I'm foxy.	1
That's not possible!	1
Ow!	2
I'm sorry it's just, Phoebe just always thought you were, you were charming in a, in a sexless kind of way.	1
Oh, y'know I-I can't hear that enough.	4
I'm sorry, I think that you just misunderstood her.	3
No, I didn't misunderstand, okay? She was all over me! She touched my bicep for crying out loud!	4
This bicep?	2
Well it's not flexed right now!	4
It's Phoebe.	0
Umm, well I sorta have some bad news, can I come in?	3
Umm, well, umm Grandma died.	3
No, she just died today! Okay, umm, we're having a memorial service tomorrow.	3
No you didn't!	1
Well, lots of people! Look, are you coming to memorial service or not?	4
anyway, his name is Allan and we've been going out for three years.	0
He was my first client when I became a party planner.	0
He was planning a party for his girlfriend at the time.	0
Oh well.	0
And he was Theta Beta Pi at Syracuse.	0
Oh. Oh, that's great!	1
Really? Like how?	2
Well y'know, we would umm, repeat everything the other said, or uh, we'd jump out of closets to scare each other, or switch the sugar for the salt so they'd put salt on their cereal.	0
That's a good one.	1
Yeah? You like that one?	2
Yeah, you're funny.	1
I'm funny?	2
Oh thank God!	1
Well hey, I've got a ton of these!	1
Umm, oh here... Do you want a good one?	0
Umm, you uh, you take a quarter, take a quarter and, and you blacken the edge.	0
Right?	0
And then you say to person, I bet you can't roll this quarter from your forehead to your chin without it leaving your face.	0
And then when they do it, they're left with a big black pencil line right down the center of their face.	0
Can I do it to you?	0
Yeah, I-I-I-I'm funny Ben, but I'm not stupid. Okay?	1
Chloe? Hi..	0
Is this about me taking your watch?	3
You took my watch?	2
I'm sorry, I do that.	3
Just you keep it, listen did you, did you tell anyone about us?	3
Oh no. I feel it isn't really anybody's business, y'know.	0
Oh, one other thing. Hoshi thinks that you being ringside may have affected my concentration.	0
Yeah. That-that was the problem.	0
Excuse me, Doug?  Hey there sports fan!!	1
Bing! You got those numbers for me?	1
So you still in touch with anyone from high school?	0
Umm. Well, there's Rachel, and umm, I think that's it. How bout you?	0
Oh yeah, I still hang with Simmons and Zana, y'know.	0
I see Spindler a lot.	0
Devane, Kelly, and I run into Goldie from time to time.	0
Stick, Brown, Sulkov, McGuire, J.T., Beardsley.	0
Is that all?	0
Ehh, y'know after high school, you just kinda lose touch. Oh yeah! I ran into Richard Dorfman.	1
Ohh, how is he?	2
Not so good, Simmons and I gave him a wedgie.	0
Isn't he an architect now?	0
Yeah, they still wear underwear.	0
So the Porsche guy took his car back.	0
But you found the keys to his clothes?	0
No. No, I just uh, I just loved the way it feels when everybody thinks I own a Porsche.	1
And people will think you own a Porsche because you're wearing the clothes?	2
Hey, Mon, I was just doing the dishes!	0
Hey!	1
Oh! It's you.  Hi.	2
What about me?! You-you just said I could!	4
I'm not even getting married! Okay, this is a question for science fiction writers!	0
I can't believe you're not picking me.	4
Hey, how can it	0
I'm not even... I'm not even	0
Fine, y'know what, that's it. From now on, Joey, I want you to be my best man.	4
Yes!  Shame about you man.	1
Hey-hey! Stanley! Hey-hey! You're leading man is here! Let's get to work.	1
Umm, slight change of plans. We've shut down.	3
Wh-what?! Why?!	2
It's a money thing, we don't have any.	3
You're kidding right?	2
No.	0
What?!	2
It-it's probably just temporary. We're hoping to get some more money soon, so if could just uh, hang out.	0
Uh, hang out?! How long?	3
I don't know.	0
A week?	4
Maybe two?	0
The money will turn up!	0
People will always wanna invest in movies!	0
Hey, you're not rich are ya?	0
No!	4
Eh, worth a shot.  Look Joey, let me know where you're staying, okay?	0
Hey pal, are you Joey Tribbiani?	0
Yeah.	0
These got left for ya.	0
Thanks.   Congratulations on your big break.	3
Rachel, do you have any muffins left?	0
Yeah, I forget which ones.	0
Oh, you're busy, that's ok, I'll get it. Anybody else want one?	0
Hey.	0
Hey!	1
So how was Joan?	0
I broke up with her.	0
Don't tell me, because of the big nostril thing?	2
Come on, they were not that huge.	0
How many perfectly fine women are you gonna reject over the most superficial insignificant things?	2
Hold it, hold it.	0
I gotta side with Chandler on this one.	0
You or me?	0
I got it. Uh, Joey, women don't have Adam's apples.	0
You guys are messing with me, right?	2
Yeah.	0
"That was a good one. For a second there, I was like, ""whoa."""	1
Oh my God, he's lost it. He's totally lost it.	3
What?	2
Or! Or, we could go to the bank, close our accounts and cut them off at the source.	0
You're a genius!	1
Aww, man, now we won't be bank buddies!	3
Now, there's two reasons.	0
Hey.	0
Hey!	1
Ohh, you guys, remember that cute client I told you about? I bit him.	0
Where?!	2
On the touchy.	0
And	0
No, I know!	2
I-I'm sorry, but the moment I touch him, I just wanna throw out my old oath and take a new, dirty one.	4
Well, next time your massaging him, you should try and distract yourself.	0
Yeah! Yeah! Yeah! Like-like when I'm doing something exciting and I don't wanna get	1
Thank you, Joey.	0
No-no, thank you.	0
Hey Estelle, listen	0
Well! Well! Well! Joey Tribbiani! So you came back huh? They	2
What are you talkin' about? I never left you! You've always been my agent!	2
Really?!	2
Yeah!	1
Oh well, no harm, no foul.	0
Okay, you guys free tonight?	0
Yeah!!	1
Tonight? You-you didn't say it was going to be at nighttime.	2
Yes? Yes?! How can I help you?	0
Yeah, we were...we were just looking around.	0
Oh-oh, you're-you're fellow scholars.	2
What exactly were you looking for, hmm?	0
Perhaps,  perhaps Dr. Chester Stock's musings on the Smiledon Californicus?	0
Uhh....	0
Ah... Ah...Get out of here!  Uh, meeting someone? Or-or are you just here to brush up on Marion's views on evolution?	4
Uh, actually I find Marion's views far too progressionist.	0
I find Marion's views far too progressionist.	0
I'm sorry, who are you?	2
I'm a professor here uh, Ross...Geller.	0
Ross Geller, why do I know that name? It's uh... Wait!  Did you write this?	2
Yes! You're the person who checked out my book?!	2
Y'know, you look nothing like I would've thought. You're...you're so young.	2
Well I uh, I skipped forth grade.	0
You had no right to tell me you ever had feelings for me.	4
What?	2
I was doing great with Julie before I found out about you.	4
Hey, I was doin' great before I found out about you. You think it's easy for me to see you with Julie?	4
The point is I...	4
I don't need this right now, OK.	4
It, it's too late, I'm with somebody else, I'm happy.	4
This ship has sailed.	4
Alright, fine, you go ahead and you do that, alright Ross.	4
Fine.	4
Cause I don't need your stupid ship.	4
Good.	4
Good.	4
Oh, it's so romantic to send people off on their honeymoon.	1
Y'know, Monica and Chandler are married. Ross and Rachel are having a baby. Maybe you and I should do something.	0
All in good time my love.	0
All in good time.	0
Oh shoot!	2
I left my guitar in their apartment.	3
Well you can let me in later.	0
I don't have a key, they took mine to give to you.	0
What?! They took mine to give to you!	2
Why would they take away our keys?	2
Wow! It looks like we got a lot of good stuff.	1
Oh we did, but my mom got us the greatest gift of all.	1
A	0
No. She's going to live with us for eight weeks.	0
Uh, what?	2
Yes! She's gonna help us take care of the baby! Woo-hoo.	1
What... You're not serious.	2
I mean she's a very nice woman, but there is no way we can take eight weeks of her.	4
Hi Ross!	1
Hi roomie!	1
Hey! What did you decide to do about the movie?	0
I don't know!	0
It's not like it's porn!	0
This is a serious, legitimate movie.	0
And the nudity is really important to the story.	0
That's what you say about porn.	0
You're right. Maybe I shouldn't even go on the call back.	0
No! No you should! A lot of major actors do nude scenes! I mean, the chance to star in a movie? Come on!	1
Well that's true.	0
And I am only naked in one scene.	0
Plus it sounds really great.	0
My character's catholic and he falls in love with this Jewish girl.	0
Who run away together and they get caught in this big rainstorm.	0
So we go into this barn and undress each other and hold each other.	0
It's really sweet and-and tender.	1
Hey, what's up?	0
Nothing, Monica and I had a stupid fight.	3
But you're still moving in together, right? Because my ad came out today.	0
"""Wanted. Female roommate, non-smoker, non-ugly."" Nice!"	1
Yeah?	0
I just figured y'know, after living with you it'd be an interesting change of pace to have a female roommate, y'know?	0
Someone I can learn from, someone-someone who's different than me.	0
And what's more different than me. A guy who's	0
So where are we going next?	0
This witness won't return my calls so we're gonna see if we can surprise him coming home.	0
Sur-surprise him? We're not, we're not gonna make anybody mad are we?	5
Come on man!  Listen so uh, are you gonna squeeze the perps shoes a little bit before he lawyers up?	1
It's a witness not a perp. And no one talks like that!	4
Yeah, no one talks like that!	4
Oh what? Like your Mr. Cop!	4
Hey, I'm more cop than you two!	4
How do you figure that?	0
Hello! I'm in the front seat, okay? I'm Gary's partner!	0
I guess so.	0
Here you go. Thank you!	0
Wait, Rach! Where's the other one?	0
Oh what, you-you want both of them?	2
Rachel Karen Green, where's the other earring?!	4
Okay, okay, okay, look, just don't freak out, but I kinda lost it.	5
I know it's in the apartment, but I	0
Well, what am I going to tell Monica? She wants to wear them tonight!	5
Tell her to wear her own earrings.	4
These	0
Nooo! Nooooo! You lent me Monica's earrings?! I'm not allowed to borrow her stuff!	4
Why not?	0
Because I lose her stuff!	4
Uh Phoebe, can I see you for a second?	0
Yeah!	0
What's going on?	0
Chandler's gone again!	2
Oh my God! Why would you play hide and seek with someone you know is a flight risk?!	3
Okay. You ready to push again?	0
I already had a baby. Leave me alone.	4
Okay, okay, come on, you can do it. You can do it!	1
Yeah!!	1
Little Leslie is here!	1
We got another one!	2
Oh my God, I can't believe I have two-two children.	2
How scary is that?	2
Come on little Chandler, it's time to be born. Come on little Chandler! Come on!	1
All right, he's coming. He's coming!	1
Hey, where's his thing?	2
Chandler's a girl!	2
Oh God, kindergarten flashback.	2
They musta read the sonogram wrong.	2
Cause they, 'cause they thought it was a boy, but Chandler's a girl!	2
Chandler's a girl!	2
Okay, keep saying it!	1
Am I too late?!	0
No-no ah, everything's okay. Everybody's healthy there's 30 fingers and 30 toes.	1
We have our babies?	2
Yeah.	1
Oh, we have our babies.	1
Hey Toby!	1
Hey Bobby.	0
It's Bob actually. Hey, you work up here, can you tell me where this Chandler	0
Uhh yeah. Yeah, it's  right, right down there.  Right there, yeah. Can I ask you why?	0
I want to talk to that bastard, see what his problem is.	4
Okay Bob listen uhh, I'm the reason you didn't get the job up here.	3
Toby don't.	3
Bob!	3
Toby! I'm not gonna let you cover for him. Anything you say right now will just get me more upset with Chandler!	4
Thank you.  Oh Joey and look at this crib! It's so cute!	1
I know! I found it on the street.	1
Are you serious... Really?! It's in such good condition.	2
Yeah.	0
Wow! Whoa-whoa what's under the covers?	2
I don't know.	0
It's moving.	5
It's still... ... It's got a tail! Get it out of here! Get it out of here!!	5
Ooh! Ah! Okay!	5
Well, I went over to Kyle's last night to pick up a few things and we got to reminiscing	0
we talked through most of the night and we realized that the reason we were so angry at each other was because there are still feelings there. So	3
Oh just say it Kyle!	2
We're gonna give it another try.	1
What about her whining and her constant need for attention?!	4
I'm gonna work on that.	0
Oh right, because you're so capable of change.	4
Y'know, he hums when he pees!	4
I do know.	0
We're so sorry.	3
That's all right, we-we don't need you. In fact, hey I'm over it already.	4
Yeah, and y'know what? I don't give a tiny rat's ass.	4
Yeah, we're gonna go.	0
I'm sorry. Ugh, Pheebs, you were, you were right about her. Y'know, she	3
Oh. Y'know, he hums while he does other stuff to.	0
Yeah, we're better off without them.	4
And y'know, even if they break up again, you'd better not let him in your sad men's club!	4
Divorced men's club.	3
Why isn't that valet back with my Porsche?	4
Maybe because you've got the keys?	4
This is totally your fault!	4
My fault?! You threatened the judge!	4
Well, you ripped the paper out of the court reporter's machine!!	4
Phoebe!	0
Yeah?	0
Have you seen Chandler?!	0
No! Why?	0
The woman from the museum called and said that there was a cancellation and that we could move up our wedding and Chandler heard!	5
I know!	5
How bad is this?	5
Well for the regular guy, it's bad, but Chandler, Oh dear God!	5
I know! I know! And he totally freaked out and I can't find him anywhere!	5
What are you gonna do?	0
Well, I'm never gonna listen to you again, that's for sure!	4
"""Y'know, harm can it do if you go and put your name down?"""	0
Rachel said that!	2
Well Rachel's not here!	4
Come on, come on.	0
Damnit, damnit, damnit, damnit.	4
This is all your fault.	4
This is supposed to be, like, the greatest day of my life, y'know?	4
My son is being born, and I should be in there, you know, instead of stuck in a closet with you.	4
The woman I love is having a baby today. I've been waiting for this just as much as you have.	4
No no no, believe me.	4
No one has been waiting for this as much as I have, ok?	4
And you know what the funny thing is?	0
When this day is over, you get to go home with the baby, ok?	4
Where does that leave me?	3
You get to be the baby's father.	0
Everyone knows who you are.	0
Who am I?	4
There's Mother's Day, there's Father's Day, there's no... Lesbian Lover Day.	3
Every day is Lesbian Lover Day.	0
This is so great.	1
You wanna explain that?	0
I mean, well, 'cause when I was growing up, you know my dad left, and my mother died, and my stepfather went to jail, so I barely had enough pieces of parents to make one whole one.	3
And here's this little baby who has like three whole parents who care about it so much that they're fighting over who gets to love it the most.	1
And it's not even born yet.	3
It's just, it's just the luckiest baby in the whole world.	1
I'm sorry, you were fighting.	3
Okay, it's a typical New York City apartment. Two girls are just hanging out.	0
Hi, how are you doing Kelly?	0
I'm doing just fine! God, Tiffany, you smell so great!	1
It's my new perfume. Why don't you come closer where you can	0
What?! Wait-wait-wait! The handsome man was about to enter!!	2
All right, I'll give you this, Mr. Peanut is a better dresser.	0
I mean he's got the monocle, he's got the top hat...	0
You know he's gay?	0
